favorite_count,source,text,in_reply_to_screen_name,is_retweet,created_at,retweet_count,id_str
67,Facebook,Here’s something you can do to help elect Steve Lonegan to the U.S. Senate this Wednesday. Make five phone calls... http://t.co/QkzCo3UvR4,,False,Mon Oct 14 21:26:44 +0000 2013,204,389864877898338304
95,Facebook,"Catch “On The Record” at 7pm ET tonight on Fox. Greta got the exclusive interview with Ted Cruz, Mike Lee &amp; me... http://t.co/LVfVzTHBPO",,False,Mon Oct 14 21:24:16 +0000 2013,181,389864253660098560
186,Facebook,"Obama’s Debt Default is on His Shoulders While We Shoulder His Impeachable Offenses

Apparently the president... http://t.co/2B8LCvinxD",,False,Mon Oct 14 19:33:31 +0000 2013,538,389836382803611648
64,Facebook,The momentum is continuing to rise for Steve Lonegan's commonsense campaign in NJ! The headline today in The... http://t.co/fS1jcGih88,,False,Mon Oct 14 16:26:54 +0000 2013,214,389789421010432000
109,Facebook,Thank you again to everyone who came out to support our vets yesterday. We met patriots who traveled from ALL... http://t.co/WGY0YbCOLS,,False,Mon Oct 14 16:23:39 +0000 2013,172,389788600759767040
216,Facebook,This is the image of the day in D.C. This is what valor looks like. This wounded vet carried a “barrycade” from... http://t.co/WkYd0dgwNl,,False,Mon Oct 14 03:05:02 +0000 2013,447,389587625419341826
101,Facebook,"Let's work to get Steve Lonegan to the Senate! Vote this Wednesday, New Jersey! Here's the video from yesterday's... http://t.co/4UoFPzIf9H",,False,Sun Oct 13 21:04:33 +0000 2013,368,389496904167751680
549,Twitter Web Client,Enjoying lunch with @SenTedCruz and @SenMikeLee. http://t.co/TSR1gKdJH5,,False,Sun Oct 13 18:08:41 +0000 2013,545,389452644705509377
69,Facebook,The momentum is on Steve Lonegan’s side coming into next Wednesday’s election in New Jersey! Please visit Steve’s... http://t.co/O1MoJIeLdy,,False,Sun Oct 13 17:34:05 +0000 2013,190,389443940501299200
111,Facebook,"I posted 13 photos on Facebook in the album ""Washington, D.C."" http://t.co/wDhPpcPD00",,False,Sun Oct 13 16:56:45 +0000 2013,245,389434544749031424
218,Facebook,"We were proud to stand with thousands of America's vets and other patriotic Americans today in Washington, D.C.... http://t.co/eOhaYXwpwF",,False,Sun Oct 13 16:42:43 +0000 2013,457,389431012905598977
243,Facebook,Todd and I are going to D.C. tomorrow to honor our vets at our war memorials. We had a great time today in NJ... http://t.co/r4RSnaTkvU,,False,Sun Oct 13 00:16:09 +0000 2013,375,389182734901313536
316,Twitter Web Client,"Great to see ""The Great One"" in the Garden State! @marklevinshow http://t.co/rkUlqN8T8w",,False,Sat Oct 12 21:07:34 +0000 2013,333,389135276053766144
77,Facebook,Take a look at this great post by Michelle McCormick at C4P. I personally think it's great not only because it's... http://t.co/fsDq8zJLbH,,False,Fri Oct 11 03:22:32 +0000 2013,177,388504866689388544
61,Facebook,"Friends, please see the article linked below. Consider this school teacher's assignment which mandates that kids... http://t.co/B9sea7h2yv",,False,Fri Oct 11 01:12:22 +0000 2013,203,388472107371606016
90,Facebook,More info on the rally in NJ this Saturday for Steve Lonegan. Hope to see you there!... http://t.co/He7XUZrMPc,,False,Thu Oct 10 21:26:19 +0000 2013,243,388415219464421376
100,Facebook,"Kudos to Sean Hannity for his hard hitting interview with Anthony Weiner. See video of it below.

Really,... http://t.co/Dc8oazy8pP",,False,Thu Oct 10 03:56:41 +0000 2013,149,388151072889765889
139,Facebook,"Looking forward to joining the ""Great One"" Mark Levin and the Tea Party Express in NJ this Saturday at a rally... http://t.co/2NJaTyNAZQ",,False,Thu Oct 10 00:59:10 +0000 2013,328,388106396233134080
60,Facebook,Yesterday I posted an article about how school officials in Wisconsin told their choir director to scale down the... http://t.co/A67Y7XU4HE,,False,Wed Oct 09 15:10:11 +0000 2013,113,387958174722326528
75,Facebook,Please watch this great video about Steve Lonegan &amp; remember to vote for him on Oct. 16! We need Steve in the... http://t.co/7yMmKerUqJ,,False,Tue Oct 08 20:02:51 +0000 2013,270,387669439027888128
96,Facebook,"Good. Need more of this. Enough is enough. Jail potentially for serving his carrot cake? Let 'em try.

Thank you... http://t.co/A3XaSAxVya",,False,Tue Oct 08 19:56:02 +0000 2013,247,387667723956015104
346,Twitter Web Client,"POTUS is basically saying,""Yes, we're bankrupt, but unless I get a blank check to keep debt growing I shall not engage the American people.""",,False,Tue Oct 08 18:23:42 +0000 2013,993,387644485548507136
79,Facebook,A Silent Night in Wausau on Monday? Bet not. Can't wait for parents to take this on.... http://t.co/dKrcCfbNZc,,False,Tue Oct 08 16:42:25 +0000 2013,143,387618998277660672
79,Twitter Web Client,Wishing @JimInhofe a speedy recovery. We need him back fighting for us in the U.S. Senate!,,False,Tue Oct 08 15:15:23 +0000 2013,181,387597094808084480
94,Facebook,"In case you missed it, ""60 Minutes"" did an excellent segment on the waste and fraud in the Federal Disability... http://t.co/86x61ok0UX",,False,Mon Oct 07 22:23:11 +0000 2013,261,387342368514789376
97,Facebook,"As Neil Cavuto just noted on Fox this morning, an article in the Washington Times highlights just how petty and... http://t.co/UKZJ2j7v4N",,False,Sat Oct 05 15:47:46 +0000 2013,292,386518082648158209
122,Facebook,"Gee Whiz, If Even Little Ol' Me Understands U.S. Government 101 but MSM Doesn't...... http://t.co/yMdykc8fzZ",,False,Fri Oct 04 18:48:33 +0000 2013,322,386201190130003968
89,Facebook,"On October 16, New Jersey has the choice of two mayors to send to the U.S. Senate. Only one of these mayors has... http://t.co/nCEp2tieBQ",,False,Thu Oct 03 17:01:43 +0000 2013,250,385811914947059712
155,Facebook,Respect our vets! http://t.co/x2zRdsQ0Fm,,False,Thu Oct 03 04:33:05 +0000 2013,341,385623514482745344
176,Twitter Web Client,"Hmmm, funding cowboy poetry or treatments for kids with cancer? Tough choice if you’re Harry Reid. http://t.co/6kRK2Ou0rR",,False,Wed Oct 02 23:06:52 +0000 2013,580,385541419223363584
190,Facebook,"My Call For Civil Disobedience Around The “Barrycades” 

It’s beyond shameful to see Barack Obama disrespect and... http://t.co/55bm2PDGkk",,False,Wed Oct 02 20:26:33 +0000 2013,470,385501074691727360
100,Facebook,Yeah. Todd bagged a moose. Dinner. Appropriate to remind folks in the GOP establishment that the progressive Bull... http://t.co/cwmOMAcSyh,,False,Tue Oct 01 21:00:17 +0000 2013,176,385147178186186752
178,Facebook,I don’t believe America has ever seen such a thing. The leader of the free world just followed Israeli Prime... http://t.co/HDyiOriN0c,,False,Tue Oct 01 20:03:00 +0000 2013,425,385132760689815552
73,Twitter Web Client,Also excited to talk to @seanhannity tonight on Fox at 9pm ET!,,False,Mon Sep 30 20:52:47 +0000 2013,112,384782900559761409
48,Twitter Web Client,"Looking forward to talking to @TeamCavuto on @FoxBusiness channel at 8pm ET. If you don't get @FoxBusiness channel, DEMAND IT!",,False,Mon Sep 30 20:50:04 +0000 2013,85,384782219358650368
74,Twitter Web Client,"Looking forward to being on @GretchenCarlson's new show today - ""The Real Story With Gretchen Carlson"" starting at 2pm ET on Fox.",,False,Mon Sep 30 17:11:59 +0000 2013,112,384727336513306624
133,Facebook,"Fighting for Us... #MakeDCListen
http://t.co/U9HkzKwZTh http://t.co/v3LmKqSlwT",,False,Sun Sep 29 01:52:50 +0000 2013,325,384133635441295360
159,Facebook,"A friend sent me this graphic today. It says it all. ""If there's a government shut down, who will spy on me,... http://t.co/QPiDROXGat",,False,Sat Sep 28 17:40:37 +0000 2013,463,384009766311567360
111,Twitter Web Client,RT @theblaze Here is a list of over 300 employers who have reportedly cut hours to avoid Obamacare tax http://t.co/H74cnP4ZUi,,False,Sat Sep 28 16:56:32 +0000 2013,414,383998672691662848
66,Facebook,"New op-ed: ""Flushing Critters &amp; Retrieving 2014."" The photo at the top is me &amp; my Dad with his antler retriever... http://t.co/DOQ3wAPRDh",,False,Sat Sep 28 16:48:32 +0000 2013,149,383996658100744192
103,Facebook,A sign of leadership failure? http://t.co/vm8E0zlnVe,,False,Sat Sep 28 03:29:58 +0000 2013,271,383795692353093632
306,Twitter Web Client,Billy Graham's full page ad imploring the release of Saeed Abedini. #SaveSaeed http://t.co/0OxvDPjDWk http://t.co/7tGUHFHaO7,,False,Thu Sep 26 17:23:24 +0000 2013,588,383280657763274752
91,Facebook,Please read Billy Graham’s impassioned plea to the new president of Iran imploring the release of the imprisoned... http://t.co/fEadtQock3,,False,Thu Sep 26 17:09:37 +0000 2013,215,383277188604514304
111,Facebook,"Our president was delusional and contradictory when he declared in his speech before the U.N. General Assembly,... http://t.co/68WxXh2KZN",,False,Wed Sep 25 18:32:06 +0000 2013,300,382935559725125632
264,Twitter Web Client,Piper's getting ready for school &amp; Ted's still going 20hrs strong! #MakeDCListen http://t.co/q6eOigHvbZ,,False,Wed Sep 25 14:53:50 +0000 2013,288,382880627508277248
74,Facebook,Piper's getting ready for school &amp; Ted's still going! Encourage kids to learn US history through this &amp; endure to... http://t.co/IfojC167vD,,False,Wed Sep 25 14:50:00 +0000 2013,145,382879664949448705
411,Twitter Web Client,Ted &amp; Mike going strong for over 10hrs. We can hear you all the way in Wasilla. DC better be listening! #MakeDCListen http://t.co/dZBhHVXR29,,False,Wed Sep 25 06:29:09 +0000 2013,558,382753619365228545
129,Facebook,Ted &amp; Mike are going strong for over 10hrs now. We can hear you all the way in Wasilla. DC better be listening!... http://t.co/ahFHZuBVop,,False,Wed Sep 25 06:08:52 +0000 2013,244,382748517988839424
101,Twitter Web Client,"Holy boldness! Thank you, David! RT @DavidLimbaugh I apologize. It's been almost a month since I have said how much I adore @SarahPalinUSA",,False,Wed Sep 25 02:13:38 +0000 2013,175,382689320747823104
370,Twitter Web Client,RT @jasonsjohnson Pic of @SenTedCruz daughters as he reads them Green Eggs &amp; Ham. #MakeDCListen http://t.co/LQVB61BmyJ,,False,Wed Sep 25 01:54:49 +0000 2013,683,382684585726722048
502,Twitter Web Client,"Stay strong @SenTedCruz! Wear comfortable shoes. As we did for Rand Paul, fortifying caribou jerky is on its way #KeepCruzing #MakeDCListen",,False,Wed Sep 25 01:30:27 +0000 2013,992,382678450567266305
146,Facebook,Looking forward to talking with Sean Hannity tonight on Fox at 9pm ET about @SenTedCruz's efforts to #MakeDCListen &amp; #DefundObamacare.,,False,Tue Sep 24 23:56:09 +0000 2013,347,382654720751706112
69,Facebook,Looking forward to speaking with Neil Cavuto on Fox at 4pm ET about the #DefundObamacare efforts.,,False,Tue Sep 24 19:33:13 +0000 2013,124,382588551705419776
84,Facebook,"The U.S. Senate has some arcane procedural rules, and as ordinary Americans our eyes glaze over trying to decipher... http://t.co/s10GBU6FnS",,False,Mon Sep 23 23:14:20 +0000 2013,214,382281809759064064
155,Facebook,Mark Levin nails it here. Remember time is short before the nation is fundamentally transformed unless we fight... http://t.co/Nfjkrmn7Hv,,False,Mon Sep 23 22:44:18 +0000 2013,522,382274250486210560
54,Facebook,Here's my nephew in Wasilla this morning enjoying the first snowfall. http://t.co/ztAAR3zOar,,False,Mon Sep 23 16:54:09 +0000 2013,67,382186135252131840
64,Facebook,"Ahhh, it's a new season! Our first snowfall. This morning. Refreshing! http://t.co/mwJAkW2HCL",,False,Mon Sep 23 16:51:48 +0000 2013,87,382185541007339520
103,Facebook,Recall that only Old Mother Hubbard went to the cupboard and cried t'was bare. Today millions see a $4 trillion... http://t.co/t1v45cnm6L,,False,Mon Sep 23 01:11:37 +0000 2013,242,381948935637856256
63,Facebook,Mitch McConnell's Campaign Manager: We Had Nothing to Do with Ted Cruz Oppo Shopping http://t.co/util2lcPiU,,False,Mon Sep 23 00:59:59 +0000 2013,194,381946007883620352
300,Twitter Web Client,@FoxNewsSunday Keep it TRULY fair &amp; balanced. Release the GOP names encouraging you to trash @SenTedCruz. No more anonymous sources.,FoxNewsSunday,False,Sun Sep 22 14:13:16 +0000 2013,1208,381783256665837569
497,Twitter Web Client,We have your backs @SenTedCruz @SenMikeLee http://t.co/RCIvsiOS2v Please RT to #DefundObamacare &amp; support these good senators.,,False,Sat Sep 21 23:23:02 +0000 2013,2223,381559222523002880
221,Facebook,"We have your backs, Ted and Mike! #DefundObamacare http://t.co/87NCzJdEO9",,False,Sat Sep 21 23:21:10 +0000 2013,512,381558751532437504
87,Facebook,And here I am doing my Annie Oakley thing.... http://t.co/Z9WZ5ah6Ko,,False,Fri Sep 20 21:58:51 +0000 2013,103,381175649496748032
59,Facebook,This is Piper mounted shooting in Montana.... http://t.co/ush9kMsbb6,,False,Fri Sep 20 21:58:03 +0000 2013,69,381175448170139648
48,Facebook,This is the from the Mother's Day hunt I mentioned in the NRO op-ed:... http://t.co/qxYxP3FoVy,,False,Fri Sep 20 21:57:04 +0000 2013,75,381175200697823233
115,Facebook,"My op-ed at National Review Online: ""As Freedom Destroys Itself: Laws can't protect a society that has lost its way"" http://t.co/APGfhIopz8",,False,Fri Sep 20 21:55:26 +0000 2013,249,381174790343892992
149,Facebook,Thanks to my Aunt Billie in Texas for sending me her friend's clever caption. http://t.co/YbywCBS1rz,,False,Thu Sep 19 23:52:09 +0000 2013,304,380841776170680320
155,Facebook,"In honor of Constitution Day, I'm rereading the great document, and I encourage everyone to do the same and to... http://t.co/vcCcCrWfQO",,False,Wed Sep 18 01:17:06 +0000 2013,323,380138377154428928
102,Facebook,My best wishes to the Jewish community today as Yom Kippur is celebrated. This is the most solemn and important... http://t.co/xBQH53RW7o,,False,Fri Sep 13 20:47:50 +0000 2013,253,378621062483030018
154,Facebook,"Union brothers and sisters, demand a full repeal of Obamacare, an immediate defunding, and some resignations. http://t.co/24F8tShVAt",,False,Thu Sep 12 23:00:46 +0000 2013,426,378292129627643905
125,Facebook,"Remember when President Obama promised us, “If you like your current health care plan, you can keep your plan?”... http://t.co/4fSEmttAWn",,False,Thu Sep 12 19:29:08 +0000 2013,375,378238869843742720
311,Facebook,Enough of this foreign fiasco distraction. Get back to work.  It is time to bomb Obamacare.... http://t.co/60rpaGbNRY,,False,Mon Sep 09 23:39:11 +0000 2013,866,377214633892794368
73,Facebook,"I posted 11 photos on Facebook in the album ""Hunting"" http://t.co/cCHODHnQSL",,False,Fri Sep 06 20:54:29 +0000 2013,141,376086022435921920
97,Facebook,"Happy birthday, Todd! He’s finally as old as I am! We’ve been away hunting this week in an “undisclosed... http://t.co/V9OmGajeOt",,False,Fri Sep 06 20:44:18 +0000 2013,112,376083456637538304
1071,Facebook,"LET ALLAH SORT IT OUT 

“So we’re bombing Syria because Syria is bombing Syria? And I’m the idiot?” - Sarah... http://t.co/0fOkN9KAZj",,False,Fri Aug 30 23:25:24 +0000 2013,3140,373587287546036224
61,Facebook,"Here’s a great photo posted on my cousin JD’s Facebook page of a reunion of Vietnam vets (3rd Battalion, 7th... http://t.co/twkIhzvFVv",,False,Fri Aug 30 21:29:37 +0000 2013,110,373558147853873152
142,Facebook,"Who are you rooting for in this? Mr. President, please give America justification before you spend blood and... http://t.co/WRrrGyWZPX",,False,Fri Aug 30 00:01:22 +0000 2013,383,373233949431963650
58,Facebook,"Love it when good things happen. (Thanks for sending this, Uncle Ron!) http://t.co/zhw7RLRfyV",,False,Thu Aug 29 22:55:10 +0000 2013,97,373217287668781056
93,Facebook,May his dream always be reality. http://t.co/8S4g6hRq4T,,False,Wed Aug 28 14:22:28 +0000 2013,169,372725878117376000
68,Facebook,"I'm just waiting for the guys to finish loading up gear, so I'm using the ""wait time"" to finish reading Mark... http://t.co/y3ZnTTCzZo",,False,Tue Aug 27 16:39:26 +0000 2013,122,372397958765215744
45,Facebook,I'm there with these folks in spirit! http://t.co/VbHnQIImDZ,,False,Tue Aug 27 16:37:10 +0000 2013,76,372397384908939264
124,Facebook,"Forced enrollment in Obama's ""Unaffordable Care Act"" is weeks away. This beast must be stopped -- by not funding... http://t.co/SfJ3VhClqV",,False,Tue Aug 27 14:20:55 +0000 2013,394,372363097430056960
98,Facebook,First day of school! http://t.co/edjZg8z23E,,False,Mon Aug 26 17:15:16 +0000 2013,113,372044586618998784
80,Facebook,First day of school! http://t.co/Ktb1yFkRid,,False,Mon Aug 26 17:12:38 +0000 2013,85,372043925433110528
68,Facebook,"So, friends...inside scoop into the “Palin World.” This is Todd’s airplane hanger (under ANOTHER  autumn double... http://t.co/8cnpaZV2PS",,False,Sun Aug 25 05:01:20 +0000 2013,86,371497498680229888
70,Facebook,http://t.co/4rkF7dvcOB http://t.co/xyUELoOye0,,False,Sat Aug 24 19:40:04 +0000 2013,126,371356250820186113
113,Facebook,My pot of gold under a double rainbow... http://t.co/0mHUEwGkzN,,False,Sat Aug 24 05:22:55 +0000 2013,102,371140541549150208
61,Facebook,Congratulations to Dance to Bristol for winning the Ballerina Stakes today! This amazing horse is on a great... http://t.co/s7olPUEGtz,,False,Fri Aug 23 22:30:02 +0000 2013,77,371036635577995264
103,Facebook,"So, the Federal Government, er, We The People, are employing someone at the Department of Homeland Security whose... http://t.co/ZI2ponbjCR",,False,Thu Aug 22 23:30:38 +0000 2013,377,370689499061583872
58,Facebook,I posted a new photo to Facebook http://t.co/jscELhnOxw,,False,Thu Aug 22 21:58:25 +0000 2013,105,370666292493426688
57,Facebook,I posted a new photo to Facebook http://t.co/knd7zeB1pS,,False,Thu Aug 22 04:09:32 +0000 2013,103,370397299929022465
54,Facebook,I posted a new photo to Facebook http://t.co/PWVgx6AQtF,,False,Thu Aug 22 03:50:37 +0000 2013,94,370392540559585281
339,Twitter Web Client,Media spent more time on Obama's new $1000 dog than evil thrill kill of Chris Lane;double standard shows LSM true colors &amp; desire to exploit,,False,Wed Aug 21 22:07:29 +0000 2013,1144,370306186941177857
90,Facebook,"Like those 3:00 am wake up calls to join my dad duck hunting in the canoe before the school day began, it's time... http://t.co/1k2cTEo85U",,False,Wed Aug 21 15:04:00 +0000 2013,125,370199612847816704
118,Facebook,Looks like the Duck Dynasty dudes aren't the only ones speaking truth to power lately. Hollywood star Ashton... http://t.co/p1JI0HZL2j,,False,Wed Aug 21 14:07:06 +0000 2013,196,370185293934379008
54,Facebook,http://t.co/EIPdkyGye8 http://t.co/7jTwS4HTD5,,False,Wed Aug 21 04:08:43 +0000 2013,80,370034706529943552
88,Facebook,Franklin Graham's Samaritan Purse again steps up to the plate to positively impact lives!  We're so thankful for... http://t.co/VXuUwKoZfZ,,False,Mon Aug 19 23:35:09 +0000 2013,197,369603474339938304
58,Facebook,Our friend Parnelli Jones celebrated his birthday and the 50th anniversary celebration of his epic Indy 500 win.... http://t.co/NgyVB33yCF,,False,Sun Aug 18 19:52:35 +0000 2013,101,369185072840073216
95,Facebook,Sent from a favorite soldier. Have a great weekend! http://t.co/v2mgrvlhkQ,,False,Fri Aug 16 23:21:57 +0000 2013,170,368512987738279936
126,Facebook,"Obama Broke Up With You. Really. Totally Unfriended You...

Bristol's spot on. Young Americans better get their... http://t.co/e5byrKBNuC",,False,Fri Aug 16 05:20:37 +0000 2013,245,368240861555204097
69,Facebook,John McCain is right about Obama completely underestimating Putin’s intensions and autocratic unwillingness to... http://t.co/05VH6oJ95D,,False,Sun Aug 11 23:53:20 +0000 2013,136,366708945462640640
78,Facebook,"See the link below. Here’s a shout out to an intelligent, independent Texan who uses her cowgirl smarts to point... http://t.co/puVbMWtFW8",,False,Sat Aug 10 21:33:30 +0000 2013,191,366311369596870657
100,Facebook,"Please see the article linked below. To the ""defenders of the truth"" in the lamestream media, I'm not sayin',... http://t.co/asummpaDtM",,False,Sat Aug 10 20:12:38 +0000 2013,242,366291016396963841
69,Facebook,Hmmm... http://t.co/XHnhdAVSNi,,False,Sat Aug 10 17:47:46 +0000 2013,159,366254561259823106
49,Twitter Web Client,Looking forward to talking to @ericbolling on #CashinIn today at 11:30am ET on FNC.,,False,Sat Aug 10 13:04:44 +0000 2013,95,366183331001413632
0,Twitter Web Client,"RT @ericbolling: Morning Everybody! #CashinIn: Rep Ellison: Govt has a RIGHT to OUR MONEY, Sarah Barracuda takes on Obama Intel Presser, 11…",,True,Sat Aug 10 13:03:00 +0000 2013,71,366182896228245505
56,Facebook,Looking forward to being on Cashin' In tomorrow on Fox at 11:30am ET. http://t.co/SaxyKtv9ZA,,False,Sat Aug 10 04:36:23 +0000 2013,110,366055403169546240
67,Facebook,"I posted 26 photos on Facebook in the album ""Lake Powell"" http://t.co/hJ3XvCDkB5",,False,Thu Aug 08 17:03:52 +0000 2013,96,365518734913310720
98,Facebook,The whole country needs to get outside and experience the amazements God created for us to enjoy. Lake Powell on... http://t.co/O6s2nTrHOC,,False,Thu Aug 08 16:57:53 +0000 2013,146,365517230550679552
91,Facebook,Ex-Border Patrol Agents Warn: Politicians Helping Cartels in U.S. http://t.co/7qMAex1f5G,,False,Thu Aug 08 14:00:07 +0000 2013,242,365472493013708804
121,Facebook,"Hey media, now do you get it? http://t.co/YjW5uq7vx5",,False,Wed Aug 07 16:29:26 +0000 2013,295,365147682995585025
90,Facebook,"""Rubbing the Back of Obama""...

Media: Your rubbing shoulders with, er, rubbing the back of, Barack Obama may get... http://t.co/jOOxOYGICG",,False,Mon Aug 05 17:44:52 +0000 2013,151,364441890222915585
200,Facebook,We haven't forgotten Obama's mocking of the Special Olympics a few years ago on Leno's show. And now we see how... http://t.co/MQhqmLVBd2,,False,Fri Aug 02 21:48:09 +0000 2013,654,363415953620480000
181,Facebook,"Love, love, love our U.S. troops! Here's another reason why! http://t.co/CYC1rqE9oK",,False,Fri Aug 02 00:58:53 +0000 2013,350,363101564061220864
54,Facebook,Heh. Cool. :) http://t.co/uUDdJ98fvw,,False,Thu Aug 01 20:59:40 +0000 2013,83,363041361831792640
141,Facebook,Wish I had been wrong about this one... http://t.co/IGRaS4mMWP,,False,Thu Aug 01 01:19:33 +0000 2013,355,362744377321340929
113,Facebook,"LIAR ON ENERGY

President Obama’s claim that the Keystone pipeline would create “maybe 2,000 jobs” during its... http://t.co/Pfpq7IyecY",,False,Wed Jul 31 22:33:49 +0000 2013,344,362702668008914946
73,Twitter Web Client,That’s not even taking into account all the service jobs created by work up there or the economic boom caused by building the pipeline.,,False,Wed Jul 31 22:06:41 +0000 2013,156,362695838448885761
57,Twitter Web Client,"An entire multi-national corporation, Alyeska Pipeline, works on &amp; for the pipeline. At its peak it provided 17% of US Domestic energy.",,False,Wed Jul 31 22:06:23 +0000 2013,163,362695762502619136
59,Twitter Web Client,There's between 12 to 15k workers transported to the North Slope every month.,,False,Wed Jul 31 22:06:03 +0000 2013,165,362695682534014977
182,Twitter Web Client,"Beckel, not pulling this punch, you are wrong on the pipeline. It employs THOUSANDS &amp; provides BILLIONS of barrels of domestic energy.",,False,Wed Jul 31 22:05:34 +0000 2013,491,362695560672706562
98,Twitter Web Client,"Did Bob Beckel just defend Obama's anti-Keystone stance by claiming the Alaska pipeline employs ""about 100 people""? Seriously?!",,False,Wed Jul 31 22:05:08 +0000 2013,290,362695448814821376
98,Facebook,"Happy 52nd Anniversary, Mom &amp; Dad! We love you, and here's just a little tribute... http://t.co/ncpuh7OWfP",,False,Mon Jul 29 18:00:48 +0000 2013,110,361909184045924353
83,Facebook,Greenwald on James Clapper: It’s Amazing He Hasn’t Been Prosecuted and Still Has His Job http://t.co/Y8TyTcScKt,,False,Mon Jul 29 15:04:19 +0000 2013,243,361864770464387072
46,Facebook,Greenwald: NSA Has Trillions of Telephone Calls in Databases http://t.co/XSxNudbbPu,,False,Mon Jul 29 15:03:48 +0000 2013,136,361864642882052098
71,Facebook,"Medal of Honor recipient Col. George ""Bud"" Day passed away yesterday. I had the honor of meeting Col. Day during... http://t.co/KiGt8droFm",,False,Sun Jul 28 22:16:19 +0000 2013,157,361611100158046211
72,Facebook,Piper’s reward for helping me out in South Dakota was a little field trip where she proved herself much braver... http://t.co/fHOmA9792j,,False,Sun Jul 28 01:32:23 +0000 2013,79,361298055380738049
65,Facebook,Piper was a great right hand man helping out at the Ag PhD Field Day in South Dakota this week. Here we are in... http://t.co/e5awR4hePG,,False,Sun Jul 28 01:31:28 +0000 2013,70,361297823695773698
78,Twitter Web Client,I'll also show viewers the redneck version of Rove’s white board tonight on “On the Record” with @gretawire at 10pm eastern.,,False,Fri Jul 26 23:55:11 +0000 2013,161,360911204987846658
84,Twitter Web Client,"Will be on On the Record tonight to discuss ""phony"" scandals. And I'll explain why the media &amp; Congress are about as popular as a cold sore.",,False,Fri Jul 26 23:54:32 +0000 2013,169,360911041527422976
0,Twitter Web Client,"RT @BretBaier: Please tune in tonight to On the Record with @gretawire for a special hour on ""Phony Scandals?""    Should be interesting.   …",,True,Fri Jul 26 23:53:57 +0000 2013,105,360910893887918081
0,Twitter Web Client,RT @gretawire: @SarahPalinUSA has no fear - tonight she takes on Pres Obama and some Repub-FOX NEWS at 10pm eastern (in 2 hrs),,True,Fri Jul 26 23:53:17 +0000 2013,111,360910729412481025
50,Twitter Web Client,"RT @gretawire if you think you have been targeted by #IRS and it is not PHONY per Pres, RT this to watch ON THE RECORD at 10pm tonight",,False,Fri Jul 26 23:52:55 +0000 2013,136,360910633899802624
