favorite_count,source,text,in_reply_to_screen_name,is_retweet,created_at,retweet_count,id_str
365,Facebook,"ABUSE OF BIRTHRIGHT CITIZENSHIP UNACCEPTABLE TO AMERICANS

Thank you, hard working, patriotic legal immigrants,... http://t.co/Pv4R02iuGD",,False,Thu Aug 20 18:34:33 +0000 2015,382,634433352498585600
250,Facebook,Truth in advertising in Hillary's new campaign slogan! Help us get the message out by clicking here:... http://t.co/kCEM8JjnP5,,False,Wed Aug 19 02:12:21 +0000 2015,243,633823785855098880
154,Facebook,Hat tip to Journal of a Madman for the thought to our team. Keep 'em coming and we'll make sure you get all the... http://t.co/GRIJYhNpPE,,False,Tue Aug 18 00:13:07 +0000 2015,145,633431394413346816
2294,Twitter Web Client,http://t.co/ZefumZGJMR,,False,Mon Aug 17 19:05:28 +0000 2015,2586,633353969733992448
196,Facebook,"Happy National Airborne Day!

https://t.co/taho6oin9u",,False,Mon Aug 17 13:12:47 +0000 2015,160,633265217418436608
478,Facebook,"Erick Erickson, 

Today a friend forwarded your apology for mocking my family – again – and in answer to your... http://t.co/tZ2NP7LRNz",,False,Sat Aug 15 07:55:39 +0000 2015,399,632460630646198272
184,Facebook,Want a Feel Good Friday? Click here:... http://t.co/JAcMxuJCnW,,False,Sat Aug 15 03:12:36 +0000 2015,130,632389400060628992
275,Facebook,"A mama grizzly warns Erick at RedState: ""Don't take on a Palin kid; when family's had enough don't expect the... http://t.co/TNqBGY1xs4",,False,Thu Aug 13 17:37:22 +0000 2015,226,631882249823195136
96,Facebook,"@jasonsjohnson - Thanks for your kind tweet! Another beautiful, hot TX day! Was proud to stand tall with those... http://t.co/vSyaa9ToBb",jasonsjohnson,False,Thu Aug 13 02:52:49 +0000 2015,107,631659644998549505
255,Facebook,"Please read this post from Franklin Graham:

https://t.co/7Pq1kbqsk7 http://t.co/K0akbZ82WI",,False,Tue Aug 11 22:53:33 +0000 2015,245,631237044354854912
406,Facebook,"Rocks and glass houses don’t go together when you’re playing PC gotcha games, so please spare us the holier than... http://t.co/3hlRmp3MoO",,False,Mon Aug 10 21:38:04 +0000 2015,322,630855658578006016
172,Facebook,Who do you think won tonight's debate? VOTE NOW! http://t.co/jnhXUZ0VIf,,False,Fri Aug 07 03:04:11 +0000 2015,126,629488177905057792
412,Facebook,If 7 years ago I had predicted the Obama administration was targeting my family and all conservatives who posed a... http://t.co/nRzOriklfc,,False,Thu Aug 06 14:08:19 +0000 2015,532,629292925042728961
402,Facebook,Happy 225th Birthday to the U.S. Coast Guard! http://t.co/uUm1bMYwOP,,False,Tue Aug 04 22:30:47 +0000 2015,251,628694599817633792
229,Facebook,This past week was Alexis de Tocqueville’s 210th birthday. This brilliant Frenchman’s insight into our national... http://t.co/RdMFHck2E1,,False,Sun Aug 02 04:13:13 +0000 2015,194,627693610750844929
209,Facebook,My latest op-ed:... http://t.co/ZqhkdPj1JN,,False,Fri Jul 31 15:23:25 +0000 2015,222,627137497693351936
551,Facebook,"Very proud that Alaska is the new home of the Chris Kyle Patriots Hospital to serve the over 100,000 active duty... http://t.co/QN3QuULoWe",,False,Fri Jul 31 14:52:27 +0000 2015,366,627129703342731264
225,Facebook,"Thank you, Senators Deb Fischer &amp; Joni Ernst, for leading the fight in the U.S. Senate to... http://t.co/P1Y6lpggdt",,False,Thu Jul 30 23:35:29 +0000 2015,213,626898941536280576
310,Facebook,Help elect more leaders committed to #DefundPlannedParenthood by clicking here:... http://t.co/fTUIO8uMdX,,False,Thu Jul 30 20:35:33 +0000 2015,290,626853659410874368
315,Facebook,Why does Planned Parenthood target minorities? Why are 80% of Planned Parenthood shops set up in minority... http://t.co/4Qw59h6gHk,,False,Wed Jul 29 22:44:35 +0000 2015,372,626523743045746688
310,Facebook,Joining The O'Reilly Factor tonight on FOX News at 8:00 PM #DefundPlannedParenthood. If you agree that... http://t.co/PNmWkMdSkT,,False,Wed Jul 29 19:48:54 +0000 2015,217,626479530589470721
369,Facebook,"Obama Calls Y'all Crazy, America. Says Americans Having Guns is Worse Than Islamic Terrorism. 

WTH?? 

Friends,... http://t.co/T1BHVgGV8B",,False,Wed Jul 29 18:52:59 +0000 2015,447,626465462059167748
366,Facebook,#DefundPlannedParenthood http://t.co/1Zu5VPZUdl,,False,Mon Jul 27 21:48:55 +0000 2015,307,625784961476481024
341,Facebook,#DefundPlannedParenthood http://t.co/ipnPIiaPB3,,False,Mon Jul 27 06:09:22 +0000 2015,250,625548513326301184
387,Facebook,#DefundPlannedParenthood http://t.co/58X82rlhoF,,False,Sun Jul 26 21:53:09 +0000 2015,289,625423635273121792
418,Facebook,#DefundPlannedParenthood http://t.co/mxTUCEv7jA,,False,Sun Jul 26 19:36:39 +0000 2015,318,625389284007276545
473,Facebook,#DefundPlannedParenthood http://t.co/FlUp0QvsnU,,False,Sun Jul 26 05:30:03 +0000 2015,314,625176231479246848
468,Facebook,#DefundPlannedParenthood http://t.co/Lbc1MSFsFK,,False,Sat Jul 25 22:38:59 +0000 2015,355,625072784088125440
173,Facebook,I posted a new photo to Facebook http://t.co/Shz33AAlTx,,False,Sat Jul 25 18:56:43 +0000 2015,161,625016847046475776
155,Facebook,"Mitt Romney once said he loved Big Bird when PBS funding was discussed. The Left went bananas. They cried, ""Do... http://t.co/sk30MTE7qJ",,False,Fri Jul 24 23:01:43 +0000 2015,157,624716116200456192
201,Facebook,"Prayers for the Cathy family following the passing of Jeannette Cathy, the beautiful, strong matriarch behind... http://t.co/rWQcS74HX9",,False,Fri Jul 24 19:22:12 +0000 2015,162,624660873903214592
340,Facebook,Time to reconsider patronizing these companies directly supporting Planned Parenthood? Yep. Make your voice heard... http://t.co/RGfIn26YOe,,False,Thu Jul 23 22:07:11 +0000 2015,387,624340006702813188
175,Facebook,Presidential candidates: which of you joined me in calling for this sham organization and it's despicable... http://t.co/6MXGoKYhbE,,False,Thu Jul 23 21:34:25 +0000 2015,183,624331758524334080
388,Facebook,"""Planned Parenthood"" equals quality health care? Nothing could be further from the truth. SHUT IT DOWN.... http://t.co/CH77JFzQ9z",,False,Wed Jul 22 20:26:31 +0000 2015,329,623952281415905280
145,Facebook,"Happy Birthday (all week), Payton! My absolute favorite nephew! (Top 7 anyway.) From performing with those... http://t.co/dpNYhO4WBt",,False,Wed Jul 22 16:27:15 +0000 2015,105,623892071720615937
222,Facebook,Another video of a Planned Parenthood official bartering to sell the bodies of butchered babies for money. And we... http://t.co/5e888zLz5Z,,False,Tue Jul 21 22:25:37 +0000 2015,299,623619866063446016
206,Facebook,"If you follow Obama administration actions this summer, you see it's their ""Summer of the Flag"". They seek to ban... http://t.co/GnJCroSsxZ",,False,Tue Jul 21 02:25:01 +0000 2015,206,623317728875663361
305,Facebook,I have the good fortune of knowing both John McCain and Donald Trump well. Both men have more in common than the... http://t.co/5Ha0Vb2kHj,,False,Mon Jul 20 22:21:22 +0000 2015,258,623256411238199296
539,Facebook,"Horrific events unfolding in Chattanooga drive us to our knees in prayer for the Marines and their families, as... http://t.co/AeFCYUjKeV",,False,Thu Jul 16 21:18:17 +0000 2015,362,621790982556811264
240,Facebook,"My latest op-ed: ""Congress, Stop the Madness of Obama's Surrender to Iran""... http://t.co/7varoRsv15",,False,Wed Jul 15 17:20:02 +0000 2015,268,621368637753065472
360,Facebook,What If They Were Dead Puppy Parts Instead of Dead Baby Parts?... http://t.co/z1PInogHFZ,,False,Wed Jul 15 16:48:05 +0000 2015,366,621360597226127360
305,Facebook,"Ask yourself, how is it that our Creator stays His hand when these atrocities happen right under His children's... http://t.co/dVd34jofhe",,False,Wed Jul 15 01:43:44 +0000 2015,233,621133009597657088
0,Twitter Web Client,RT @KateOH: Will @KirstenPowers take on the story of #PlannedParenthood trafficking in body parts of aborted infants? She broke the #Gosnel…,,True,Wed Jul 15 01:42:20 +0000 2015,248,621132658509156352
303,Facebook,A very happy birthday to a special friend - Franklin Graham. His work around the world through Samaritan's Purse... http://t.co/nU9saa0EJx,,False,Tue Jul 14 21:01:01 +0000 2015,219,621061862071906304
105,Facebook,http://t.co/Hg1uEvn9Xj http://t.co/pGU6DP1Jsd,,False,Tue Jul 14 20:50:01 +0000 2015,109,621059095634821120
179,Facebook,"Hmmm, today is ""World Population Day,"" whatever the heck that means. Better than that though, it's this guy's... http://t.co/8k1iABhIxJ",,False,Sat Jul 11 21:22:27 +0000 2015,141,619980092660428800
213,Facebook,"DEATH PANELS STILL NOT DEAD

Politicians just don't get it. Their ""Death Panels"" still won't die. Last night... http://t.co/Fd298GCJl3",,False,Thu Jul 09 23:06:10 +0000 2015,286,619281419857195012
184,Facebook,"CROSSHAIRS ARE BACK 

Evil jihadists raping, enslaving, killing women; crucifying Christians; beheading anyone... http://t.co/pF7NdTMSW9",,False,Thu Jul 09 17:33:37 +0000 2015,202,619197731475746817
289,Facebook,Liberals are famous for conveniently rewriting their history. Just take a look at some of the photos below for a... http://t.co/QLeKXahjSy,,False,Wed Jul 08 23:33:03 +0000 2015,306,618925797634637824
212,Facebook,Kudos to Lynne Russell and her brave husband for reminding us that our Second Amendment “saves lives”! When you... http://t.co/I1wVETUn1R,,False,Wed Jul 08 20:47:02 +0000 2015,195,618884014787665921
128,Facebook,http://t.co/uC7NnhKoCE,,False,Wed Jul 08 01:53:02 +0000 2015,116,618598638038720512
400,Facebook,"Happy Birthday, Mrs. Reagan! Thank you for all you have done for our country! 

- Sarah Palin http://t.co/Kdgiykuo33",,False,Mon Jul 06 16:48:22 +0000 2015,241,618099177822789632
491,Facebook,"Congratulations to Team USA for their amazing Women’s World Cup victory! #FightLikeAGirl

And on this great... http://t.co/lJ38yKUa4w",,False,Mon Jul 06 02:03:20 +0000 2015,197,617876450960609280
389,Facebook,"Happy Fourth of July! This day epitomizes what is unique and beautiful about the greatest nation on earth, our... http://t.co/N3biBqWkEd",,False,Sat Jul 04 14:22:36 +0000 2015,243,617337720407330817
203,Facebook,"Just a quick pre-Independence Day post, remembering last 4th of July family reunion in Coeur d'Alene; so thankful... http://t.co/JPbtpzzMXV",,False,Sat Jul 04 02:57:55 +0000 2015,121,617165411063308288
213,Facebook,"Dear Friends,

YOU are the success of SarahPAC! Thanks to your support, SarahPAC has grown to become one of the... http://t.co/HamDIR1vC3",,False,Mon Jun 29 20:48:04 +0000 2015,176,615622785214324736
154,Facebook,"My latest op-ed:
http://t.co/mqMaelKHDt http://t.co/CNAZMCFb9k",,False,Sat Jun 27 14:36:28 +0000 2015,173,614804495202152448
831,Facebook,"Is it too much to ask ""Constitutional Scholars"" to be faithful to the Constitution?

The most intrusive big... http://t.co/aDhFDjpeh8",,False,Sat Jun 27 02:12:44 +0000 2015,586,614617328198791172
158,Facebook,"Since politicians just can't leave well enough alone, and evidently have nothing else to do, they’ve decided to... http://t.co/VACLnuhS5v",,False,Wed Jun 24 00:52:09 +0000 2015,179,613509883430871040
329,Facebook,Once again the “Great One” Mark Levin is spot on for calling out the shameful way the House GOP leadership is... http://t.co/IAqCOLT5a4,,False,Tue Jun 23 03:11:40 +0000 2015,359,613182605173899264
367,Facebook,Happy Father's Day to all the dads out there. Thank you for being the rock upon which a family can be built! http://t.co/YFNkXunDkY,,False,Sun Jun 21 15:01:37 +0000 2015,197,612636497573974016
354,Facebook,Why can't politics be put aside in the wake of South Carolina's mourning? Politicians - please try. It would be... http://t.co/Bt25OSbIC9,,False,Sun Jun 21 03:54:19 +0000 2015,242,612468563065094144
154,Facebook,Everyone who’s read “Going Rogue” knows what a special place Michigan has in my heart. I’m thrilled to be in the... http://t.co/xYUB0pMzxY,,False,Fri Jun 19 08:45:24 +0000 2015,133,611817040354086912
248,Facebook,Sincere sorrow is shared after hearing the news out of South Carolina. Our prayers are for the victims and their... http://t.co/qOZNxbVhuZ,,False,Thu Jun 18 18:30:42 +0000 2015,185,611601949222420480
120,Facebook,"FOX News' Gretchen Carlson just wrote a great inspirational memoir called ""Getting Real,” and if you need an... http://t.co/BptTbw5AYQ",,False,Wed Jun 17 23:10:03 +0000 2015,140,611309861503111168
310,Facebook,@realDonaldTrump - Mr. Trump should know he's doing something right when the malcontents go ballistic in the... http://t.co/FS9UkxNBk9,realDonaldTrump,False,Wed Jun 17 14:48:52 +0000 2015,276,611183734285578240
213,Facebook,Encouraging to see the strength and diversity the GOP has to offer voters as the 2016 race continues to unfold.... http://t.co/3IXSKOX8Mb,,False,Tue Jun 16 02:02:35 +0000 2015,192,610628505034952704
183,Facebook,":-) Well, who would have known that Alaska is home of the most diverse place in America?

*Sigh*

The media, in... http://t.co/34UK0HIjgj",,False,Mon Jun 15 23:26:11 +0000 2015,158,610589146034388994
233,Facebook,"Hey Girls! You Don't Need No Stinkin' Government to Succeed! 

This week in Hillary Clinton's true hometown of... http://t.co/FSYgIDhbAD",,False,Mon Jun 15 17:26:30 +0000 2015,256,610498628591976449
308,Facebook,"󾌴 Ok, I'm sorry. I shouldn't laugh... this hard. I know this isn't a victimless crime, what this white chick... http://t.co/67FQvTsroX",,False,Sat Jun 13 03:12:31 +0000 2015,256,609558940356116480
203,Facebook,"The secretive, hugely impacting Obamatrade deal is another behind-closed-doors fast-tracked D.C. deal that... http://t.co/l6hrMLzwQe",,False,Fri Jun 12 05:14:17 +0000 2015,275,609227196834648064
200,Facebook,"On June 14th, America celebrates Flag Day. We’re celebrating more than just a bolt of cloth with stripes and... http://t.co/SjGBrAOvAK",,False,Thu Jun 11 18:25:37 +0000 2015,196,609063955668025344
142,Facebook,"Thank you for this reminder, friends in the great state of Minnesota! http://t.co/CdCmzN1De6",,False,Wed Jun 10 15:40:01 +0000 2015,162,608659892497477632
181,Facebook,I'll be joining Sean Hannity tonight on FOX News - if you want to tune in at 10 PM ET. http://t.co/P4pHXtgtBy,,False,Mon Jun 08 21:16:34 +0000 2015,148,608019813580087296
202,Facebook,"Family grows with a new critter! Meet Piper's newest - a micro mini pig she's named Penelope.
Yup.

- Sarah &amp;... http://t.co/apyruL6llK",,False,Sun Jun 07 22:53:18 +0000 2015,139,607681766929928192
460,Facebook,"On this 71st Anniversary of D-Day, may God bless our Greatest Generation for the sacrifices they made for our... http://t.co/j1oLRQR48B",,False,Sun Jun 07 03:38:23 +0000 2015,317,607391125821898752
385,Facebook,"HEY LENA, WHY NOT LAUGH OFF EVERYONE'S SEXUAL ""EXPERIMENTS"" AS YOU HAUGHTILY ENJOY REWARDS FOR YOUR OWN... http://t.co/LVmOPuLpYM",,False,Thu Jun 04 18:37:44 +0000 2015,336,606530288089501698
266,Facebook,These “Clinton Cash” scandals keep piling up; they illustrate the insiders' skewed priorities and disrespect for... http://t.co/RcNuLHkjRg,,False,Thu Jun 04 01:21:06 +0000 2015,304,606269413751431169
145,Facebook,This is hilarious!... http://t.co/eo75BNeiOL,,False,Tue Jun 02 20:44:11 +0000 2015,141,605837336660746243
160,Facebook,"For a very good summer read, please get Taya Kyle’s wonderful book “American Wife.” Her personal story connects... http://t.co/XflA3M7i8Q",,False,Tue Jun 02 19:15:55 +0000 2015,144,605815124029403137
106,Facebook,"A COACH WITH INFLUENTIAL INTEGRITY
 
If you need some spirit-lifting all-American true story telling, watch the... http://t.co/T8csu5MKE2",,False,Tue Jun 02 19:07:50 +0000 2015,127,605813087220801536
136,Facebook,"For a very good summer read, please get Taya Kyle’s wonderful book “American Wife.” Her personal story connects... http://t.co/IFdFWldUcf",,False,Tue Jun 02 18:58:18 +0000 2015,136,605810688607420416
497,Facebook,"Our family's prayers are with the Biden family tonight on the loss of their son, brother, husband and father,... http://t.co/Lyvlu6waNj",,False,Sun May 31 04:33:44 +0000 2015,329,604868339161276417
191,Facebook,Yet another anti-freedom politician jumps in the race today for POTUS. As cool as he is with his rock 'n roll... http://t.co/6wLeIklWP0,,False,Sat May 30 20:11:00 +0000 2015,189,604741820044746754
198,Facebook,"If you love America, 
If you are determined our battles were not in vain,
If you help a troubled vet who fought... http://t.co/gtpCPhUa8H",,False,Thu May 28 20:40:33 +0000 2015,163,604024481422667776
393,Facebook,"As you enjoy time with friends and family today, don't forget the selfless souls who made our freedom possible.... http://t.co/r67iW9Izmb",,False,Mon May 25 17:58:07 +0000 2015,242,602896442169151488
193,Facebook,"Kicking off Memorial Day weekend, here's to any and all looking for a bridge over troubled waters. Every person... http://t.co/nZjtEaYDGE",,False,Sat May 23 16:33:51 +0000 2015,177,602150458405298176
119,Facebook,Here’s a worthy cause to contribute to that costs nothing but your energy! This effort encourages runners and... http://t.co/0G6DyJjIGw,,False,Fri May 22 17:09:34 +0000 2015,125,601797061374300160
161,Facebook,I posted a new photo to Facebook http://t.co/3eQPY4YbQz,,False,Thu May 21 22:47:17 +0000 2015,139,601519662791286784
202,Facebook,"Celebrating the last day of school! What a GREAT day! New chapters in life, always unfolding.",,False,Tue May 19 21:19:45 +0000 2015,116,600772857967321088
234,Facebook,It's unfortunate and potentially frightening knowing that everywhere you look today jihad is on the march – even... http://t.co/9RRWTecWuY,,False,Mon May 18 21:03:50 +0000 2015,254,600406462456823808
207,Facebook,Bristol and Dakota couldn’t be more thankful for the love and support of family and friends over the past months... http://t.co/gpu7xgwXNy,,False,Mon May 18 17:02:07 +0000 2015,123,600345632965025793
233,Facebook,Todd and I are very excited to attend the SEAL-NSW Family Foundation fundraiser tomorrow aboard the historic USS... http://t.co/Ayh3CEBkNE,,False,Sat May 16 06:31:08 +0000 2015,169,599462063820414976
417,Facebook,...and to all mothers who rock the cradle – you make the world go 'round!,,False,Sun May 10 19:03:43 +0000 2015,240,597477133875814400
122,Facebook,http://t.co/GcxTXTMG7c,,False,Sat May 09 16:49:28 +0000 2015,117,597080959087935488
237,Facebook,"Those honoring the National Day of Prayer this week are committed to our nation's biblical foundation, and we... http://t.co/oMWBgi5Uh9",,False,Fri May 08 15:42:41 +0000 2015,212,596701764776304640
242,Facebook,"Friends, please take time to read this article as it rips the veil exposing Obama's priorities in dealing with a... http://t.co/PibfhffEbK",,False,Sat May 02 15:53:51 +0000 2015,358,594530246386438144
1395,Twitter Web Client,http://t.co/53lWSAhlPm,,False,Thu Apr 30 00:02:26 +0000 2015,1059,593566041105543169
176,Facebook,"From out of ashes He reveals beauty, and I consider Toya Graham and Robert Valentine beautiful amidst the... http://t.co/FkN1Fg1nyi",,False,Wed Apr 29 23:59:44 +0000 2015,154,593565358956670977
135,Facebook,I posted a new photo to Facebook http://t.co/N9xV1qt6ax,,False,Fri Apr 24 19:59:31 +0000 2015,128,591692966621782016
128,Facebook,"Congratulations to our friend Marylou Whitney, philanthropist, horse lover, member of a celebrated horse racing... http://t.co/LolZVGgmkP",,False,Fri Apr 24 01:36:53 +0000 2015,130,591415482621755393
173,Facebook,Celebrating the boys' birthdays – in new snow on 4/20! Trig takes another lap on his restored '88 Élan (thank... http://t.co/s0WxV7dP1F,,False,Tue Apr 21 16:55:23 +0000 2015,129,590559465671421952
258,Facebook,Taya Kyle shows her strength and grace again last night at the ACM! This beautiful American woman introduced a... http://t.co/ut2Gnnrbk7,,False,Mon Apr 20 23:19:12 +0000 2015,159,590293668055146497
178,Twitter Web Client,"...'tis not new.Obama joined media goons to do same in '08,remember?McCain &amp; others still must ask: Where do I go to get my reputation back?",,False,Sat Apr 18 20:12:14 +0000 2015,189,589521842932613120
153,Twitter Web Client,"Obama's New Political Strategy: Attack Individual Republicans http://t.co/E4dG7AnUn8 via @Newsmax_Media // Agree, however...",,False,Sat Apr 18 20:11:12 +0000 2015,194,589521580532715521
254,Facebook,America - you ready for the real Hillary? Some of us are; join us and begin here...... http://t.co/5V1yiMzNWq,,False,Sat Apr 18 04:30:20 +0000 2015,250,589284806132965376
172,Facebook,Surprised a recent dust up with Hollywood became an actual news story today – People magazine pretty much summed... http://t.co/T3sl67dfMr,,False,Thu Apr 16 23:30:30 +0000 2015,151,588846961312276480
220,Facebook,"Hmmm, as people all over the country are reminding each other, this Hillary Scooby-Doo Tour thing sure looks... http://t.co/ktJv3QTsEr",,False,Thu Apr 16 15:02:34 +0000 2015,229,588719136290840577
147,Facebook,"Doug Giles is a go-to guy for inspiration, friends. I shouted him out again last night in a pro-Second Amendment... http://t.co/PgWXoEpObu",,False,Sun Apr 12 16:02:04 +0000 2015,149,587284559173181440
184,Facebook,Now that was a great time with hunters and conservationists of the Safari Club International Lake Superior... http://t.co/tGfuxIZdNK,,False,Sun Apr 12 01:15:49 +0000 2015,155,587061527615827968
195,Facebook,Happily enroute to Minnesota to break bread with great Safari Club International hunters and conservationists! I... http://t.co/wLv4ops6f0,,False,Fri Apr 10 20:19:55 +0000 2015,148,586624671484903424
438,Facebook,Happy Easter! http://t.co/fxo9NqQt2V,,False,Sun Apr 05 18:44:35 +0000 2015,193,584788741023207424
130,Facebook,You won't even believe this... http://t.co/spTCOl98E7,,False,Fri Apr 03 19:45:06 +0000 2015,160,584079195334139907
189,Facebook,Good message from Dakota on defeating ISIS instead of being sitting ducks. And great line about living in a state... http://t.co/SlsSagzKOj,,False,Fri Apr 03 19:44:32 +0000 2015,192,584079050924236800
247,Facebook,"As crazy as it sounds, a U.S. citizen who leaves this country to join ISIS, al Qaeda, or any other terrorist... http://t.co/gMKWB8efFw",,False,Fri Mar 27 23:10:07 +0000 2015,283,581594074655903744
358,Facebook,"When President Obama traded one deserter for five evil terrorists hell-bent on destroying America, rational... http://t.co/mGjvvylBsZ",,False,Thu Mar 26 20:44:10 +0000 2015,437,581194957807050752
250,Facebook,Dolly Parton lets the Lord's light shine right through her! She met a special young fan who faces challenges that... http://t.co/j1KlhONXEl,,False,Wed Mar 25 22:19:00 +0000 2015,199,580856436483342337
316,Twitter Web Client,"Happy Birthday, Dad! With bulldog determination, you have set a great example for us all! http://t.co/vZ3P8o1gWj",,False,Tue Mar 24 21:33:55 +0000 2015,170,580482703113478144
226,Facebook,The number of misdeeds at the scandal-plagued VA continues to grow. Our vets deserve better!... http://t.co/Xa84pAYYOz,,False,Tue Mar 24 18:07:21 +0000 2015,259,580430718255390720
149,Facebook,http://t.co/jBorlnfTNE... http://t.co/QfuAkMJhAc,,False,Sun Mar 22 05:23:47 +0000 2015,129,579513784504606720
125,Facebook,Important issues discussed on http://t.co/txeozBU965 -- some upcoming topics are include in this short video. http://t.co/oubiKXAZdT,,False,Fri Mar 20 17:27:01 +0000 2015,148,578971015746813952
199,Facebook,#throwbackthursday Happy Birthday to our little girl all grown up! http://t.co/akkH4nqZ6j,,False,Thu Mar 19 18:58:48 +0000 2015,138,578631727217786880
163,Facebook,I posted a new photo to Facebook http://t.co/znpOvSzeVt,,False,Thu Mar 19 15:29:10 +0000 2015,137,578578968359632896
1291,Facebook,"Congratulations, Prime Minister Netanyahu. Thank you to the good people of Israel for supporting a leader who... http://t.co/R9FqgGoVmg",,False,Wed Mar 18 00:02:07 +0000 2015,1054,577983282207461376
249,Facebook,Happy St. Patrick's Day! http://t.co/gmni7njRSl,,False,Tue Mar 17 15:27:10 +0000 2015,166,577853692407341058
336,Facebook,"It’s called karma, dear.

Guess it's comforting to have selective amnesia when you're a bully who attacks strong,... http://t.co/ZcWCGSQDi0",,False,Mon Mar 16 22:34:36 +0000 2015,244,577598868222820352
596,Facebook,Our families couldn’t be happier for Bristol and Dakota! We’re honored to welcome Dakota into our family. He’s an... http://t.co/WOzMUKycso,,False,Sat Mar 14 21:30:02 +0000 2015,296,576857845326548992
883,Twitter Web Client,http://t.co/TEEy373svl,,False,Sat Mar 14 18:59:57 +0000 2015,422,576820074331389953
151,Facebook,http://t.co/OseuV8wv4o http://t.co/XFPLV2YZtN,,False,Sat Mar 14 18:50:53 +0000 2015,113,576817795335323648
616,Facebook,Our prayers are with the military families of our soldiers and Marines lost last night in a tragic training... http://t.co/GDj9x3FGbs,,False,Wed Mar 11 22:01:14 +0000 2015,510,575778532636364802
129,Facebook,"Robotic deer decoys, wedding bells and shotgun shells, urban anglers and cruising with California game wardens --... http://t.co/t62534Ynz7",,False,Wed Mar 11 20:53:20 +0000 2015,118,575761444664385538
211,Facebook,I posted a new photo to Facebook http://t.co/d0NleK0C1e,,False,Wed Mar 11 15:19:01 +0000 2015,217,575677313989353473
544,Twitter Web Client,"For important context and facts on the Clinton email scandal, please read my latest op-ed: http://t.co/TxSPeHPPTD http://t.co/7J7dSsDQ2E",,False,Mon Mar 09 20:34:01 +0000 2015,723,575031808858832896
157,Facebook,"For important context and facts on the Clinton email scandal, please read my latest op-ed:... http://t.co/6rxmWU3XFN",,False,Mon Mar 09 20:30:52 +0000 2015,190,575031016970039296
247,Twitter Web Client,"RT @fxnopinion .@SarahPalinUSA: I faced tough questions over email, so should @HillaryClinton http://t.co/Mlxcuhq2cU",,False,Mon Mar 09 19:42:13 +0000 2015,274,575018774560030720
