favorite_count,source,text,in_reply_to_screen_name,is_retweet,created_at,retweet_count,id_str
34,Twitter for BlackBerry®,"Life=10% circumstances, 90% your reaction to circumstances. Sunday's ""Sarah Palin's AK 'Alaskan Hospitality'"" episode illustrates that a bit",,False,Fri Dec 10 14:46:57 +0000 2010,170,13243274546380800
16,Twitter Web Client,RT @WSJopinion Sarah Palin: Why I Support the Ryan Roadmap: Let's not settle for the big-government status quo... http://on.wsj.com/ifUkMq,,False,Fri Dec 10 04:47:28 +0000 2010,69,13092409118294016
22,Facebook,Please follow the link to my WSJ op-ed on Rep. Paul Ryan's Roadmap. Government today is far too big and too... http://fb.me/OXQwbGnu,,False,Fri Dec 10 04:45:19 +0000 2010,86,13091870993289216
22,Twitter for BlackBerry®,"Nope, silly uninformed folks, not nec ""Narnia""; the works of CS Lewis (Fellow@ Oxford, Chair@ Cambridge) should be read by the uninspired :)",,False,Fri Dec 10 04:43:54 +0000 2010,66,13091511960866816
28,Twitter for BlackBerry®,"Screwtape Letters,Mere Christianity;even The New Yorker agrees ""If wit/wisdom, style/scholarship r requisites...(CS)Lewis (is) among angels""",,False,Fri Dec 10 04:30:02 +0000 2010,95,13088023394652161
9,Facebook,Leather-Bound Edition of “America By Heart” and Alaska Book Signing Date http://fb.me/MCGFbGe9,,False,Fri Dec 10 02:48:24 +0000 2010,33,13062447548076032
0,Twitter for BlackBerry®,RT @newsbusters: Sloppy ABC Misleads on Estate Tax Being 'Slashed'; It Will Actually Increase 35 Percent http://ow.ly/1anFK5,,True,Thu Dec 09 22:53:13 +0000 2010,69,13003258981253120
0,Twitter for BlackBerry®,"RT @KevinNR: You know, @sarahpalinusa  , NR-reading correlates with the success of Supreme Court nominees. Just sayin' http://on.fb.me/g ...",,True,Thu Dec 09 20:55:56 +0000 2010,14,12973746671321088
24,Twitter for BlackBerry®,...America's solvency. Read Sowell: http://washingtonexaminer.com/opinion/columnists/2010/12/thomas-sowell-tax-cut-rhetoric-doesnt-cut-it,,False,Wed Dec 08 18:01:14 +0000 2010,94,12567392324419584
21,Twitter for BlackBerry®,"Obviously Obama is so very, very wrong on the economy & spins GOP tax cut goals;so fiscal conservatives: we expect you to fight for us &...",,False,Wed Dec 08 18:00:33 +0000 2010,90,12567221448482816
13,Twitter for BlackBerry®,"Sue for Secretary of Defense! MT ""@SPAlaska: Sue Aikens, Life@ Kavik River Camp: Meet Sue Aikens at Kavik... http://bit.ly/f6fsuI #SPAlaska""",,False,Wed Dec 08 16:52:33 +0000 2010,33,12550109585743872
0,Twitter for BlackBerry®,"RT @JedediahBila: Thank you, @JimDeMint - DeMint comes out against tax deal, says GOP must do ‘better than this’ - http://t.co/BmjsAh3",,True,Wed Dec 08 16:48:40 +0000 2010,49,12549132237414400
0,Twitter for BlackBerry®,RT @amandacarpenter: Full transcript of DeMint's interview with Hewitt is available here: http://bit.ly/gdBLuy,,True,Wed Dec 08 03:08:33 +0000 2010,29,12342740360630273
0,Twitter for BlackBerry®,"RT @HeyTammyBruce: Hey liberals, so many of you are criticizing Obama these days. When did you all become racist? #justwondering",,True,Wed Dec 08 02:54:32 +0000 2010,674,12339213546557440
31,Twitter for BlackBerry®,"Very sorry for Elizabeth Edward's family. May God comfort her kids, especially, through this tough time. God bless her family &  loved ones.",,False,Wed Dec 08 00:17:43 +0000 2010,307,12299749277310977
20,Twitter for BlackBerry®,"RT ""@michellemalkin: Save this. RT @i88schwartz: VIDEO--Obama: ""The Unemployment Rate Is Going To Be Going Down"" http://bit.ly/dKkCX0""",,False,Tue Dec 07 20:11:07 +0000 2010,57,12237692733489152
0,Twitter for BlackBerry®,RT @NRO: Traffic Nirvana: Julian Assange Notices Sarah Palin’s Criticism (via @jimgeraghty) http://bit.ly/dXP9za,,True,Tue Dec 07 20:08:41 +0000 2010,22,12237080105066496
14,Twitter for BlackBerry®,Someone making things up again?Keep seeing this quote attributed to me.Huh?Wikileaks Assange on Sarah Palin’s Criticism http://bit.ly/dXP9za,,False,Tue Dec 07 20:08:31 +0000 2010,74,12237036832432128
0,Twitter for BlackBerry®,"RT @biggovt: Tuesday Open Thread: Infamy Edition: Today, in 1941, the Japanese Imperial Navy attacked Pearl Harbor. It was a ... http:// ...",,True,Tue Dec 07 11:16:19 +0000 2010,74,12103103952199680
24,Twitter Web Client,"Bailouts for irresponsible state government spending? Not no, but hell no... read: http://is.gd/ik3Sr",,False,Tue Dec 07 05:16:58 +0000 2010,123,12012670576238592
13,Facebook,Bailouts Reward Bad Behavior http://fb.me/NLcMq1E7,,False,Tue Dec 07 05:15:28 +0000 2010,61,12012293097259008
57,Twitter Web Client,Think Obama's tax policies are wise? Watch this... http://youtu.be/Xj7nRc3_EG0,,False,Mon Dec 06 01:25:23 +0000 2010,209,11592004232286208
17,Facebook,"Tonight's hunting episode of Sarah Palin's Alaska ""controversial""? 
Really? Unless you've never worn leather... http://fb.me/HY3gXBVo",,False,Sun Dec 05 16:44:19 +0000 2010,96,11460871070949377
40,Twitter Web Client,I remain proudly intolerant of anti-hunting hypocrisy. :),,False,Sun Dec 05 16:25:11 +0000 2010,216,11456057108860928
33,Twitter Web Client,"Unless you've never worn leather shoes, sat upon a leather couch or eaten a piece of meat, save your condemnation of tonight's episode.",,False,Sun Dec 05 16:24:25 +0000 2010,189,11455862967111680
9,Twitter Web Client,"""Controversial"" Sarah Palin's Alaska hunting episode tonight? Really?",,False,Sun Dec 05 16:23:11 +0000 2010,54,11455553649778688
8,Facebook,Ted Nugent will be on the SPAlaska.com podcast an hour before the TLC show airs to talk about hunting. Follow the... http://fb.me/vwQFWjjo,,False,Sun Dec 05 16:18:27 +0000 2010,44,11454361951535104
15,Facebook,"Check out this video of Ted Nugent talking about the next episode of ""Sarah Palin's Alaska,"" and tune in to TLC... http://fb.me/wVDOcviU",,False,Sun Dec 05 16:09:12 +0000 2010,61,11452033349451777
0,Twitter for BlackBerry®,"RT @bighollywood: Sneak Peek at ‘Sarah Palin’s Alaska’: Definitely Not PETA Approved: On Sarah Palin’s Alaska, the state nickname ... ht ...",,True,Sat Dec 04 23:46:29 +0000 2010,43,11204726678888448
46,Twitter for BlackBerry®,"Happy Hanukkah! Rebelling against oppressors, enduring great threats=Jewish community encourages perseverance &belief in miracles;we honor u",,False,Fri Dec 03 13:30:07 +0000 2010,239,10687225134055424
17,Facebook,Happy Hanukkah http://fb.me/M08zojxm,,False,Fri Dec 03 05:34:50 +0000 2010,75,10567617295163392
27,Twitter for BlackBerry®,"PETA: yes, that is responsible hunting you see in ""Sarah Palin's Alaska"" video tease for Sunday night. Remember - we eat, therefore we hunt.",,False,Fri Dec 03 05:22:04 +0000 2010,158,10564401010581504
9,Facebook,"...You'll also see us hunting at the edge of ANWR, where you can see the uninhabited lands that 
warehouse... http://fb.me/Mh6PXATl",,False,Fri Dec 03 05:21:25 +0000 2010,40,10564239437594625
10,Facebook,"Tune in to ""Sarah Palin's Alaska"" this Sunday at 9pm ET/8pm central on 
TLC to see how we fill our freezers and... http://fb.me/LZk3maHT",,False,Fri Dec 03 05:20:33 +0000 2010,44,10564021325402112
0,Twitter for BlackBerry®,"RT @C4Palin: ""America By Heart"" Will Debut at #2 on the NY Times Non-Fiction Bestseller List/Open Thread http://bit.ly/hbqQcU #tcot #palin",,True,Fri Dec 03 02:47:43 +0000 2010,31,10525560778264576
13,Twitter for BlackBerry®,"Awesome Iowa!Thank u! & just heard America by Heart is #2 NYT bestseller list behind Pres.Bush's good book,so thanks for sharing inspiration",,False,Thu Dec 02 20:09:04 +0000 2010,70,10425237220888576
8,Facebook,"Enjoy this video from ""Sarah Palin's Alaska"" about how we manage our fish for abundance. http://fb.me/NTKDAFFg",,False,Thu Dec 02 16:15:39 +0000 2010,42,10366494063992832
4,Twitter for BlackBerry®,"I'll post deleted ""SP's AK"" scene to show what worked on as Governor w/Fish & Game Dept to sustain fishery 4 abundance 4 future generations",,False,Thu Dec 02 16:09:34 +0000 2010,22,10364961456922624
19,Twitter for BlackBerry®,"Dad & I hunt in Sunday's ""Sarah Palin's Alaska"" (PETA has heyday w/this one, but organic protein-loving/Outdoor enthusiasts can appreciate!)",,False,Thu Dec 02 15:41:19 +0000 2010,96,10357854720491520
11,Twitter for BlackBerry®,today from here in Iowa @ book signing;No doubt hard working Iowa residents will agree that Obama Tax Hikes (29 days from now) will slam 'em,,False,Thu Dec 02 15:01:07 +0000 2010,34,10347736066949120
11,Twitter for BlackBerry®,DC politicians: Trust businesses & families to spend our own hard earned $ wiser than you can spend it; I'll tune in Obama Tax Hike talk...,,False,Thu Dec 02 14:58:33 +0000 2010,54,10347092786544641
21,Twitter for BlackBerry®,"Dear Sen.Gregg:Yes, Obama's tax policy means ""generating massive revenues"" but that means govt will engage in massive spends;that's not good",,False,Wed Dec 01 22:53:06 +0000 2010,104,10104127237398528
11,Twitter for BlackBerry®,Thanks! (Wait til Sunday hunt episode!)MT @C4Palin: Ratings Sarah Palin's Alaska Up 17% for Episode Three http://bit.ly/hxyKdn  #tcot #palin,,False,Wed Dec 01 14:16:42 +0000 2010,40,9974170209226753
10,Twitter for BlackBerry®,Merry Christmas season! Joy to be in Tennessee today 4 start of December;look forward to *America by Heart* book event here/Kentucky tonight,,False,Wed Dec 01 14:05:25 +0000 2010,39,9971332645126146
30,Twitter for BlackBerry®,"Pls refer to Jan.1 tax changes appropriately: they're OBAMA TAX HIKES & they'll slam every American's savings, investments & job opportunity",,False,Wed Dec 01 05:20:12 +0000 2010,258,9839155014017024
18,Facebook,The Case for Extending All the Tax Cuts http://fb.me/ysiA9Zzs,,False,Wed Dec 01 03:17:25 +0000 2010,84,9808255928762368
0,Twitter for BlackBerry®,RT @SPAlaska: Editing Room Floor: Counting Fish with Tim Sands: We’ve been spending a lot of time talking about fish... http://bit.ly/f8 ...,,True,Tue Nov 30 20:00:25 +0000 2010,9,9698283463118848
11,Twitter Web Client,"Congress can act now to encourage and authorize the WH to use ""all necessary means to respond to and defeat WikiLeaks"" http://bit.ly/gAxLIc",,False,Tue Nov 30 16:51:40 +0000 2010,87,9650784195051521
10,Twitter for BlackBerry®,Let's hope Congress & WH can deal w/2 things @ once today: stop incoming tax hikes (due 31 days from now) AND deal w/Wikileaks fiasco. Both.,,False,Tue Nov 30 16:41:48 +0000 2010,85,9648301330661377
9,Facebook,“America By Heart” Book Tour and Reviews http://fb.me/P919owNf,,False,Tue Nov 30 11:25:00 +0000 2010,37,9568574226042880
10,Twitter for BlackBerry®,"""America by Heart"" book tour=encouraging & energizing! Thank you, New Orleans! Wonderful people.Look forward to tomorrow's Baton Rouge event",,False,Tue Nov 30 03:59:29 +0000 2010,36,9456455002361856
37,Facebook,Serious Questions about the Obama Administration's Incompetence in the Wikileaks Fiasco http://fb.me/MHXrvuW9,,False,Mon Nov 29 20:18:01 +0000 2010,145,9340324879011841
0,Twitter for BlackBerry®,"RT @SPAlaska: What We Can Learn from Special Needs Children: Prior to last night’s episode of Sarah Palin’s Alaska, ... http://bit.ly/ff ...",,True,Mon Nov 29 16:16:25 +0000 2010,32,9279522876694528
9,Twitter for BlackBerry®,"Appreciate the big heart of Texas! Last night in Dallas, today in Houston... thankful for the good folks we get to meet at the book events!",,False,Mon Nov 29 14:42:22 +0000 2010,48,9255853618106368
44,Twitter for BlackBerry®,"Inexplicable: I recently won in court to stop my book ""America by Heart"" from being leaked,but US Govt can't stop Wikileaks' treasonous act?",,False,Mon Nov 29 14:25:36 +0000 2010,326,9251635779866625
12,Facebook,"...You’ll also learn a
little about our Alaska Native culture from Todd’s Yup’ik Eskimo family as well
as the... http://fb.me/Jh9IJhF6",,False,Sun Nov 28 20:13:47 +0000 2010,30,8976871890878464
6,Facebook,"...In the process, you’ll learn that our family fishing
businesses are a lot like family farms – passed on from... http://fb.me/FI9tobd7",,False,Sun Nov 28 20:11:43 +0000 2010,19,8976352954818560
6,Facebook,"I truly hope you'll enjoy tonight’s episode of “Sarah Palin’s
Alaska.” Please tune in at 9pm ET/8central to see a... http://fb.me/Fu9CRNOk",,False,Sun Nov 28 20:10:26 +0000 2010,57,8976027388739586
12,Twitter for BlackBerry®,"http://twitpic.com/3b30qu - Coolest cake I've ever seen!Alaska salmon & forget-me-nots, plus Kansas sunflowers!Thank u Dillons!",,False,Sun Nov 28 16:49:22 +0000 2010,53,8925426252517376
0,Twitter for BlackBerry®,"RT @SPAlaska: Talk to Us: Fathers, Sons, Family Businesses and Parents of Special Needs Children: Sarah Palin’s Alas... http://bit.ly/gF ...",,True,Sun Nov 28 14:20:36 +0000 2010,24,8887991116234753
7,Twitter for BlackBerry®,"Wichita awakens to picture perfect morning, we're looking @ scenic Arkansas River right now. Can't wait to meet KS residents @ book signing!",,False,Sun Nov 28 14:10:21 +0000 2010,46,8885410868498432
6,Twitter for BlackBerry®,"wild salmon runs- the WORLD'S richest!""Sarah Palin's AK""shows how we manage & harvest protein sources for abundance;we're feeding the world!",,False,Sun Nov 28 03:22:43 +0000 2010,50,8722429492862977
12,Twitter for BlackBerry®,"It seems God poured His bucket of rich natural resources up North,incl resources 2 energize & feed the world;tomrrw we highlight Bristol Bay",,False,Sun Nov 28 03:20:02 +0000 2010,51,8721752645435392
15,Twitter for BlackBerry®,"Nebraska was great...talk about great, down-to-earth patriots who value hard work!Thank u for the refreshing Heartland visit. Next - Iowa!",,False,Sat Nov 27 20:09:57 +0000 2010,95,8613519247282176
35,Twitter for BlackBerry®,"Tomorrow-""Sarah Palin's Alaska"" we slay salmon. A bunch of 'em. (Watch the Left's reaction to that, if harvesting halibut freaked them out!)",,False,Sat Nov 27 16:54:06 +0000 2010,204,8564233180545024
19,Twitter for BlackBerry®,Thank you Oklahoma!We appreciate you! Just landed in crisp & cool Nebraska;look forward to tomorrow's America by Heart book event in Norfolk,,False,Sat Nov 27 05:45:48 +0000 2010,52,8396046111612928
16,Twitter for BlackBerry®,America by Heart book signing in Tulsa tonight!Thankful 4 Thanksgiving break so my girls can meet & greet great Americans w/me on book tour,,False,Fri Nov 26 18:34:17 +0000 2010,54,8227055699230720
0,Twitter for BlackBerry®,"RT @the_USO: For all they sacrifice, give our troops a much needed ""thank you"" for Thanksgiving via @the_USO USO.org/thanks #thankful",,True,Fri Nov 26 04:21:51 +0000 2010,199,8012532274954240
73,Facebook,A Thanksgiving Message to All 57 States http://fb.me/LJ1YUjfz,,False,Fri Nov 26 00:38:33 +0000 2010,293,7956337585557504
13,Twitter for BlackBerry®,"Like family farms, our Bristol Bay commercial fish business works the same way.Watch Sunday on TLC;see work ethic rewarded out on the water!",,False,Wed Nov 24 19:06:57 +0000 2010,51,7510500879372289
16,Facebook,"Please remember to tune in to TLC on Sunday at 9pm ET/8central
 for a special episode of ""Sarah Palin's Alaska""... http://fb.me/OQkxCTao",,False,Wed Nov 24 18:48:51 +0000 2010,64,7505944611135488
27,Twitter for BlackBerry®,So very sorry for the loss of 29 lives in New Zealand's Pike River Mine. May prayers comfort the families & loved ones who will never forget,,False,Wed Nov 24 05:55:40 +0000 2010,196,7311367195336704
35,Twitter for BlackBerry®,"Congrats Jen,Kyle,Bristol,et al, for proving competition is GOOD! Remember: ""They're going to criticize anyway, so you might as well dance!""",,False,Wed Nov 24 04:23:28 +0000 2010,202,7288164305604608
19,Twitter for BlackBerry®,"Well, what a great ride! Competition is good for everyone.Be inspired by those who step up to challenges & improve w/each step;Congrats Jen!",,False,Wed Nov 24 04:20:06 +0000 2010,160,7287317475622912
14,Facebook,"""America By Heart"" is out in bookstores today and available online for purchase. Our book tour kicks off at 6pm... http://fb.me/ObsQbfme",,False,Tue Nov 23 20:49:28 +0000 2010,77,7173909958889472
16,Facebook,Another Exclusive Sneak Peek of “America By Heart” http://fb.me/OtouZknm,,False,Mon Nov 22 22:47:19 +0000 2010,57,6841183686893568
21,Twitter for BlackBerry®,"http://twitpic.com/390krk - Happy B'day Molly!It's cold,but post-NFL on tv, Preston ""Sarah Palin's Alaska""tonight=warm gathering",,False,Mon Nov 22 00:47:06 +0000 2010,42,6508939420114945
16,Twitter for BlackBerry®,http://twitpic.com/390g9p - Meanwhile Mark & No-Drama-Mama Bristol keeping good perspective@ dance studio;Fun! &warmer than here,,False,Mon Nov 22 00:30:53 +0000 2010,57,6504856168697857
0,Twitter for BlackBerry®,RT @AmSpec: 'Huge Win' for Palin Publisher vs. Gawker http://bit.ly/cXHfz5,,True,Sun Nov 21 02:59:33 +0000 2010,68,6179881150844928
18,Facebook,An Exclusive Sneak Peek at “America By Heart” http://fb.me/Ofclxbe1,,False,Sat Nov 20 18:12:45 +0000 2010,68,6047308676341760
28,Twitter for BlackBerry®,"Entering Thanksgiving season remember we're promised life that is ""abundant w/challenges, running over w/possibilities!"" - Charles Swindoll",,False,Sat Nov 20 16:32:28 +0000 2010,156,6022073805705217
27,Twitter for BlackBerry®,Law enforcemnt profiles individuals/suspects when seeking info 2 prevent or deal w/other crimes;Why can't this be done @ airports 2 prevent?,,False,Sat Nov 20 02:13:13 +0000 2010,145,5805836051939328
34,Twitter for BlackBerry®,"TSA: why politically incorrect 2 ""profile"" anyone re: natl security issues?we profile individuals/suspects in other situations! profile away",,False,Sat Nov 20 02:09:05 +0000 2010,217,5804795818418176
0,Twitter for BlackBerry®,RT @michellemalkin: The Obamacare Waiver-mania! movement builds. Lots of updates: http://is.gd/hqjvq,,True,Fri Nov 19 16:03:27 +0000 2010,91,5652383262572544
12,Twitter for BlackBerry®,make tx cuts perm;quit punishing work ethic.Swallow w/promising Obama the credit...whatever it takes to break impasse & save US jobs/economy,,False,Fri Nov 19 15:21:47 +0000 2010,100,5641894533005312
20,Twitter for BlackBerry®,"43 days til job-killing tax hikes slam 70% of job-creators. 7 yrs of ignoring this oncoming train wreck, it's time we demand DC deal w/this,",,False,Fri Nov 19 15:20:20 +0000 2010,141,5641533210501120
19,Facebook,"Want to see a Palin mother-daughter day? It’s a bit unconventional unless you consider slaying slimy halibut,... http://fb.me/LU1wYO9M",,False,Fri Nov 19 03:51:10 +0000 2010,77,5468096928161792
8,Twitter for BlackBerry®,"@SarahPalinUSA linked to nice article about THIRD DAY's ""Follow Me There"" theme song- Alaska show. Check it out! Nice! http://bit.ly/cgjwj1 ",SarahPalinUSA,False,Fri Nov 19 01:23:16 +0000 2010,51,5430877458792449
25,Twitter for BlackBerry®,The publishing world is LEAKING out-of-context excerpts of my book w/out my permission? Isn't that illegal?MT @C4Palin http://bit.ly/cD6DOQ,,False,Thu Nov 18 23:10:35 +0000 2010,130,5397487489646593
15,Twitter for BlackBerry®,"Ah yes...Bristol-the-diva! Silly critics! See her diva-ish-ness Sunday,""Sarah Palin's Alaska"" 2 learn truth, before assuming.Thanks & enjoy!",,False,Thu Nov 18 22:30:37 +0000 2010,115,5387429053730816
14,Twitter for BlackBerry®,"Left's failed economic policy dismisses will of independent Americans;our will is for our govt to back off,let work ethic & innovation soar!",,False,Thu Nov 18 17:45:05 +0000 2010,103,5315569733607424
5,Twitter for BlackBerry®,44 days away: more job-killers (incl tax increase on US job creators). Congress loads lame duck session w everything BUT job-friendly action,,False,Thu Nov 18 17:43:38 +0000 2010,90,5315206624313344
10,Facebook,"Very excited about the November 23rd release of my new book ""America By Heart."" You can pre-order a limited... http://fb.me/LbEz7JZj",,False,Wed Nov 17 21:17:28 +0000 2010,80,5006628994682880
12,Twitter Web Client,Our thoughts and prayers are with the F-22 pilot and his family. http://is.gd/hixpU,,False,Wed Nov 17 20:59:16 +0000 2010,84,5002049653575680
19,Twitter for BlackBerry®,"Proud of all the competitors & pros in DWTS. Nice journeys & beautiful, inspiring stories shining through each individual!",,False,Wed Nov 17 03:44:40 +0000 2010,102,4741683602264064
17,Facebook,http://fb.me/KloEmhZ9,,False,Tue Nov 16 21:50:52 +0000 2010,63,4652647403495424
17,Twitter for BlackBerry®,Thanks 4 tuning in 2 Alaska's epic landscape & resource-rich showcase! In coming wks you'll see the hard work/blue collar jobs that feed USA,,False,Tue Nov 16 13:59:49 +0000 2010,72,4534105551147008
13,Twitter for BlackBerry®,"Wrapped up Judge Napolitano FOX interview,his new show time tonight- GOOD! Now fly 2 LA 2 c Bristol's ""Passion of the Christ""pasadoble/waltz",,False,Mon Nov 15 22:16:06 +0000 2010,54,4296612415279104
34,Twitter Web Client,Secret Walmart report shows what every mama grizzly knows: groceries have become more expensive http://www.cnbc.com/id/40135092,,False,Sun Nov 14 16:12:24 +0000 2010,137,3842693729878016
19,Facebook,"Happy to see that the Dove Foundation gave ""Sarah Palin's Alaska"" a five out of five rating as uplifting... http://fb.me/Estp4jUW",,False,Sun Nov 14 16:10:19 +0000 2010,78,3842172147208192
20,Twitter for BlackBerry®,"Nice! Dove Foundation awards ""5-out-of-5 Family Approved Seal for all ages""; SarahPalin's AK is positive, uplifting family outdoor adventure",,False,Sun Nov 14 13:23:46 +0000 2010,76,3800256512794624
12,Twitter for BlackBerry®,Think I messed up Kate O'Hare's Hot Cuppa TV blog address w that last tweet. Try this: http://blog.zap2it.com/kate_ohare/,,False,Sat Nov 13 20:03:33 +0000 2010,25,3538477446602754
8,Twitter for BlackBerry®,"Kate O'Hare's worked w Mark Burnett before, capturing his intent & motivation as he opens world's eye 2 adventure blog.zap2it.com/kate_ohare",,False,Sat Nov 13 20:02:15 +0000 2010,18,3538149368139776
4,Twitter for BlackBerry®,"Thank u C4P!""Ordinary Barbarians"" in the Windy City 2 get that second wind/celebrate mid-term vote/gear up 2 hold'em accountable! luv u guys",,False,Sat Nov 13 16:34:05 +0000 2010,45,3485763471671296
33,Twitter Web Client,An Open Letter to Republican Freshmen Members of Congress... read: http://is.gd/gZEkI,,False,Sat Nov 13 08:39:19 +0000 2010,126,3366282753744896
13,Twitter for BlackBerry®,Just 1 more msg before calling it a night;will FB post my congratulatory note 2 incoming GOP Congressmen wherein I implore: don't get wobbly,,False,Sat Nov 13 05:16:14 +0000 2010,47,3315175683788800
25,Twitter for BlackBerry®,"""No matter I do, they're going to criticize, so I might as well DANCE!""- Bristol Follow Me There! (To Alaska!) read: http://is.gd/gZj7l",,False,Sat Nov 13 03:54:15 +0000 2010,68,3294546553212928
13,Twitter Web Client,Follow Me There! (To Alaska!)... read: http://is.gd/gZj7l,,False,Sat Nov 13 03:44:25 +0000 2010,42,3292072048074752
11,Twitter Web Client,The Major $25 News Story... read: http://is.gd/gZgCn,,False,Sat Nov 13 03:15:07 +0000 2010,36,3284698520358912
9,Twitter for BlackBerry®,"LSM, including Anchorage's KTUU: pls do simple homework before getting in tizzy over multi-million $ SarahPAC's $25 discrepancy. Please? $25",,False,Sat Nov 13 03:13:18 +0000 2010,44,3284239265042433
18,Twitter Web Client,“America By Heart” Book Tour... read: http://is.gd/gYzvg,,False,Fri Nov 12 18:37:54 +0000 2010,42,3154535073710080
18,Facebook,"We captured over 600 photos while in production on ""Sarah Palin’s Alaska"" this summer. Click here for a few of my... http://fb.me/LPQW8GK8",,False,Fri Nov 12 17:27:13 +0000 2010,48,3136749391839232
14,Twitter for BlackBerry®,"Parker: appreciate your admittance. Now, I'm still standing;Standing by family, faith & flag. Who do u stand by today? http://bit.ly/d5p72x",,False,Fri Nov 12 16:13:26 +0000 2010,104,3118177764507651
0,Twitter for BlackBerry®,RT @SPAlaska: You Are What You Watch: Television has evolved from just a simple act of zoning out into true real-tim... http://bit.ly/dk ...,,True,Fri Nov 12 14:41:11 +0000 2010,33,3094962639998977
6,Twitter for BlackBerry®,"""America by Heart"" available Nov 23! We'll kick off tour then;wrap up in Alaska...add stops like we did w Going Rogue tour,depending on time",,False,Fri Nov 12 14:32:15 +0000 2010,39,3092715797483521
8,Twitter for BlackBerry®,"Family gearing up 4 Thanksgiving break book tour; anxious 4 kids 2 have ""what I did on my vacation"" experiences in great US towns along way",,False,Fri Nov 12 14:28:11 +0000 2010,36,3091693964361728
15,Twitter Web Client,Happy Veterans Day... read: http://is.gd/gVw1R,,False,Thu Nov 11 08:00:10 +0000 2010,117,2631656036900864
11,Twitter for BlackBerry®,"Great to spend Veterans Day eve w/Gov Rick Perry, AG Greg Abbott & Pastor Stephan Broden in TX; anxious to read Perry's new book ""Fed Up""",,False,Thu Nov 11 06:40:05 +0000 2010,50,2611501806395392
20,Facebook,"""Sarah Palin’s Alaska"" premieres Sunday at 9/8c on TLC. Click here for some sneak peeks:... http://fb.me/JClHGWur",,False,Wed Nov 10 19:46:47 +0000 2010,111,2447094409334784
11,Twitter Web Client,Obama’s Clever Way to Punt the Tough Calls: Driving the Dollar Down... read: http://is.gd/gUqFE,,False,Wed Nov 10 18:21:04 +0000 2010,67,2425522801876992
11,Twitter for BlackBerry®,"Semper Fi! Thank you & Happy Birthday! RT ""@TheNatlGuard: We'd like to wish the @USMC a very Happy 235th Birthday!  #Marines #USMCBirthday""",,False,Wed Nov 10 18:14:53 +0000 2010,118,2423969193922560
8,Twitter for BlackBerry®,"RT ""@JoeWMiller: Miller Seeks to Uphold Valid Ballot Count & State Law http://t.co/WCJszig files complaint & motion for prelim injunction""",,False,Wed Nov 10 11:34:45 +0000 2010,32,2323271257161728
16,Twitter for BlackBerry®,http://twitpic.com/35e24f - Gotta hand it 2 Mark Burnett &TLC...clever marketing sticker! I'll no doubt keep giving 'em material,,False,Tue Nov 09 19:50:06 +0000 2010,80,2085540866297856
