favorite_count,source,text,in_reply_to_screen_name,is_retweet,created_at,retweet_count,id_str
0,TweetDeck,"Linda: ""I think we need to have a strong economy for our country in general. Let's get our economy back on track."" #ctsen #ctsendebate",,False,Mon Oct 15 23:31:38 +0000 2012,1,257987125960654848
0,TweetDeck,Murphy has no jobs plan. #ctsen #ctsendebate ~Staff,,False,Mon Oct 15 23:30:31 +0000 2012,0,257986845588205568
0,TweetDeck,"Linda: ""I want the middle class to have jobs so they can have money in their pockets."" #ctsen #ctsendebate",,False,Mon Oct 15 23:29:15 +0000 2012,3,257986524988203009
0,TweetDeck,RT @LisaCriscuolo: @Linda_McMahon I love how Chris Murphy didn't answer the question about Jobs creation.,,False,Mon Oct 15 23:28:18 +0000 2012,1,257986285724119040
0,TweetDeck,RT @Crabbygoat: @Linda_McMahon Murphy is mean spirited and wrong.,,True,Mon Oct 15 23:23:28 +0000 2012,2,257985069854121984
0,TweetDeck,"5,031 days in elected office and still no jobs plan from Chris Murphy. http://t.co/2mOYEIcL #ctsen #ctsendebate ~Staff",,False,Mon Oct 15 23:21:56 +0000 2012,1,257984685655867392
0,TweetDeck,Does Chris Murphy talk about anything but Linda? #ctsen #ctsendebate ~Staff,,False,Mon Oct 15 23:20:36 +0000 2012,3,257984349184593921
0,TweetDeck,Another attack on Linda. Another answer with zero specifics from Chris Murphy. ~Staff #ctsen,,False,Mon Oct 15 23:19:36 +0000 2012,1,257984096775585793
0,TweetDeck,"UConn economist, Steven Lanza, says middle-class tax cuts, like those in Linda’s plan, help stimulate the economy #ctsen #ctsendebate ~Staff",,False,Mon Oct 15 23:17:53 +0000 2012,6,257983663743057920
0,TweetDeck,"Linda: ""We can't send the very people back to Washington who created this mess and expect them to fix it."" #ctsen #ctsendebate",,False,Mon Oct 15 23:16:40 +0000 2012,3,257983359123329026
0,TweetDeck,Connecticut can't afford another 6 years of Chris Murphy's failed policies. #ctsen #ctsendebate ~Staff,,False,Mon Oct 15 23:15:59 +0000 2012,5,257983185592410113
0,TweetDeck,Chris Murphy has #nojobsplan. Is that the type of Senator you want?! #ctsen #ctsendebate ~Staff,,False,Mon Oct 15 23:15:15 +0000 2012,1,257983001500209153
0,TweetDeck,Has Chris Murphy done anything but attack Linda? Does he have a plan? ~Staff,,False,Mon Oct 15 23:14:05 +0000 2012,1,257982707336900608
0,TweetDeck,Chris Murphy is out of touch. Voted to raise taxes on the middle class. #ctsen #ctsendebate ~Staff,,False,Mon Oct 15 23:14:03 +0000 2012,0,257982702194671616
0,TweetDeck,There is no mathematics to Chris Murphy's tax plan because it doesn't exist. http://t.co/Mwp93FmX #nospecifics ~Staff,,False,Mon Oct 15 23:13:01 +0000 2012,2,257982440382021632
0,TweetDeck,Count is 3 false Murphy attacks in less than 5 minutes. ~Staff #ctsen,,False,Mon Oct 15 23:09:51 +0000 2012,2,257981644995178496
0,TweetDeck,"Since Congressman Murphy took office, nearly 5.5 million people have lost jobs. #ctsen #ctsendebate ~Staff",,False,Mon Oct 15 23:09:03 +0000 2012,1,257981443324641281
0,TweetDeck,"Murphy's new ""Buy American"" plan is ""Buy Norwegian."" #ctsen #ctsendebate ~Staff",,False,Mon Oct 15 23:08:07 +0000 2012,1,257981208544288770
0,TweetDeck,Chris Murphy promises bipartisanship but votes w/ his party 98% of the time. #ctsen #ctsendebate ~Staff,,False,Mon Oct 15 23:05:49 +0000 2012,1,257980627876446208
0,TweetDeck,Chris Murphy is proud of his plan but not proud enough to tell us what it is. #ctsen #ctsendebate ~Staff,,False,Mon Oct 15 23:05:34 +0000 2012,0,257980566387970048
0,TweetDeck,"Less then 30 seconds into #ctsen debate and Chris Murphy registers first attack, when he has no jobs plan. ~Staff",,False,Mon Oct 15 23:05:02 +0000 2012,1,257980431960535041
1,TweetDeck,Linda's plan will put people back to work and will grow the economy. #ctsen #ctsendebate ~Staff,,False,Mon Oct 15 23:03:29 +0000 2012,2,257980040204124161
0,TweetDeck,The only candidate in the race with a jobs plan and a plan to cut taxes for the middle class: Linda McMahon. #ctsen #ctsendebate ~Staff,,False,Mon Oct 15 23:02:34 +0000 2012,2,257979811287425025
0,Twitter for iPhone,RT if you're excited for tonight's debate! Tune in at 7 pm on WTNH. #ctsen #ctsendebate ~Staff http://t.co/guaH73HZ,,False,Mon Oct 15 22:13:32 +0000 2012,14,257967469854072832
0,TweetDeck,"Join our new coalition ""Norwegians for Murphy!"" Congressman Murphy loves Norway. http://t.co/xKs5kKSA #ctsen ~Staff",,False,Mon Oct 15 14:22:42 +0000 2012,3,257848982338940928
0,TweetDeck,".@ChrisMurphyCT scraps ""Buy American"" plan for new ""Buy Norwegian"" plan. WATCH our new ad: http://t.co/xKs5kKSA and RT! #ctsen ~Staff",,False,Mon Oct 15 12:24:22 +0000 2012,5,257819201820061696
8,Twitter for iPhone,Special thanks to the College Republicans from George Washington University for all their help this weekend! #ctsen http://t.co/VI0xHKAD,,False,Sun Oct 14 21:27:32 +0000 2012,17,257593507005485056
3,TweetDeck,RT if you agree voter fraud is no laughing matter: http://t.co/0Jfi3EHA #ctsen ~Staff,,False,Sun Oct 14 19:56:36 +0000 2012,41,257570623457460224
1,TweetDeck,Caught on camera: Bridgeport Mayor Bill Finch promises he will deliver the vote for Congressman Murphy. http://t.co/Wb4tVHca #ctsen ~Staff,,False,Sun Oct 14 18:01:41 +0000 2012,4,257541702376632321
1,Twitter for iPhone,Spent my morning at Jesus Saves Ministries in Bridgeport w/ Bishop Gaskins and Pastor Gaskins. #ctsen http://t.co/LQB2UtCn,,False,Sun Oct 14 17:22:17 +0000 2012,1,257531784789651456
1,Twitter for iPhone,Chatted with voters and their families at the Portland Agricultural Fair! #ctsen http://t.co/dcknW8Yj,,False,Sun Oct 14 00:18:49 +0000 2012,7,257274221099626496
3,Twitter for iPad,"Watch Murphy: “@DRUDGE_REPORT: VIDEO: Dems joke they'll get enough votes to win -- even a couple of days late! http://t.co/4Jeyd3ee"" ~Staff",,False,Sat Oct 13 21:00:48 +0000 2012,13,257224390045999105
0,Twitter for iPhone,Enjoying the Glastonbury Apple Fest. Great music and good family fun! #ctsen http://t.co/5VXSbev2,,False,Sat Oct 13 19:19:51 +0000 2012,2,257198983036932096
0,Twitter for iPhone,Talked with the firefighters at the Tolland Fire Department Open House! #ctsen http://t.co/ON8t0pue,,False,Sat Oct 13 17:42:41 +0000 2012,2,257174533147090944
0,Twitter for iPhone,Beautiful day at the Tolland Antique Tractor/Engine Show! #ctsen http://t.co/AGTr3QZ2,,False,Sat Oct 13 16:02:01 +0000 2012,2,257149195838967810
0,TweetDeck,#FF #ctsen #ctsendebate @foxct @hartfordcourant @uconn @wfsbnews,,False,Sat Oct 13 00:23:03 +0000 2012,1,256912901024120832
1,Twitter for iPhone,Talked to voters while cheering on the Glastonbury Tomahawks at tonight's game! #ctsen http://t.co/4ga4LtJr,,False,Sat Oct 13 00:19:03 +0000 2012,2,256911893535547392
1,TweetDeck,Our new radio ad sets the record straight on Linda's commitment to Medicare &amp; Social Security: http://t.co/etvqIWBb RT! #ctsen ~Staff,,False,Fri Oct 12 20:16:37 +0000 2012,3,256850883252477952
0,TweetDeck,Debate analysis shows Murphy attacked Linda more than 3 times as much as he talked about issues: http://t.co/IHqRSCgj #ctsen ~Staff,,False,Fri Oct 12 14:57:54 +0000 2012,4,256770676822790145
0,TweetDeck,@MaureenWolf1 Thank you!,MaureenWolf1,False,Fri Oct 12 00:32:02 +0000 2012,0,256552775054401536
0,TweetDeck,@loopy4444 Thank you!,puppylovegirl4,False,Fri Oct 12 00:29:11 +0000 2012,0,256552056452677632
1,TweetDeck,"CT deserves a Senator who will be an honest, hardworking servant to the people of Connecticut. http://t.co/jMi4P1WB #ctsen",,False,Fri Oct 12 00:21:34 +0000 2012,2,256550139001446400
0,TweetDeck,Was Murphy using notes? REPLY with what you think! #ctsen #ctsendebate ~Staff,,False,Fri Oct 12 00:15:43 +0000 2012,1,256548665756372992
0,TweetDeck,"Linda: ""I'd be honored to have your vote on November 6th."" #ctsen #ctsendebate",,False,Thu Oct 11 23:56:15 +0000 2012,3,256543769673994241
0,TweetDeck,"Linda: ""We can't afford 6 more years of Congressman Murphy's failed policies."" #ctsen #ctsendebate",,False,Thu Oct 11 23:55:40 +0000 2012,4,256543624089706496
1,TweetDeck,"Linda: ""It's time to elect a Senator who's a job creator and who will stand up for the middle class."" #ctsen #ctsendebate",,False,Thu Oct 11 23:55:20 +0000 2012,1,256543539440283649
0,TweetDeck,"Chris, how can you stand up for people when you don't show up for work? #ctsen #ctsendebate ~Staff",,False,Thu Oct 11 23:54:39 +0000 2012,1,256543364344844288
0,TweetDeck,Chris Murphy has never had a real job. #ctsen #ctsendebate ~Staff,,False,Thu Oct 11 23:52:36 +0000 2012,3,256542851649896448
1,TweetDeck,"We need job creators, not career politicians in Washington. #ctsen #ctsendebate ~Staff",,False,Thu Oct 11 23:51:25 +0000 2012,2,256542553954992129
0,TweetDeck,"Congressman Murphy's actions against Electric Boat could cost CT 35,000 jobs. #ctsen #ctsendebate ~Staff",,False,Thu Oct 11 23:50:55 +0000 2012,3,256542428322988032
0,TweetDeck,"Linda: ""Congressman Murphy has voted against funding for Electric Boat - TWICE."" #ctsen #ctsendebate",,False,Thu Oct 11 23:49:43 +0000 2012,2,256542125997576193
0,TweetDeck,Chris Murphy votes with his party 98% of the time. Puts party over Connecticut. #ctsen #ctsendebate ~Staff,,False,Thu Oct 11 23:45:39 +0000 2012,1,256541099189997568
1,TweetDeck,Fact: Linda has missed 1 vote in the last 12 years. #ctsen #ctsendebate ~Staff,,False,Thu Oct 11 23:44:03 +0000 2012,1,256540697509896194
1,TweetDeck,"Linda: ""I'm an independent thinker."" #ctsen #ctsendebate",,False,Thu Oct 11 23:38:39 +0000 2012,2,256539340430274561
0,TweetDeck,"Linda: ""Only in Washington can you skip 75% of your job and get paid $170,000 a year and then ask for a promotion."" #ctsen #ctsendebate",,False,Thu Oct 11 23:35:56 +0000 2012,11,256538654346993664
0,TweetDeck,"Chris, release the records. #ctsen #ctsendebate ~Staff",,False,Thu Oct 11 23:35:00 +0000 2012,1,256538422670413825
0,TweetDeck,RT @biancaagondekk: Watching the debate! #TeamLinda @Linda_McMahon,,True,Thu Oct 11 23:34:22 +0000 2012,1,256538260518625281
0,TweetDeck,Murphy made $1 million and skipped 75% of his work. #ctsen #ctsendebate ~Staff,,False,Thu Oct 11 23:33:59 +0000 2012,1,256538166926913536
0,TweetDeck,"Linda: ""Congressman Murphy, release the records."" #ctsen #ctsendebate",,False,Thu Oct 11 23:33:31 +0000 2012,3,256538049561907200
0,TweetDeck,"Linda: ""Congressman Murphy needs to be honest with the people of Connecticut."" #ctsen #ctsendebate",,False,Thu Oct 11 23:32:32 +0000 2012,2,256537799874969600
0,TweetDeck,"Linda: ""Chris Murphy talks about everything but jobs and the economy because he has no plan."" #ctsen #ctsendebate",,False,Thu Oct 11 23:30:12 +0000 2012,3,256537212009713664
0,TweetDeck,Difference between Linda and Chris Murphy: proven job creator and career politician. #ctsen #ctsendebate ~Staff,,False,Thu Oct 11 23:29:47 +0000 2012,3,256537106858524672
0,TweetDeck,"Linda: ""I am a pro-choice candidate and have always been a pro-choice candidate."" #ctsen #ctsendebate",,False,Thu Oct 11 23:27:31 +0000 2012,2,256536537632735233
1,TweetDeck,Women care about jobs and the economy. #ctsen #ctsendebate ~Staff,,False,Thu Oct 11 23:26:00 +0000 2012,1,256536156810919936
0,TweetDeck,"Linda: ""Healthcare should be affordable, accessible, and portable."" #ctsen #ctsendebate ~Staff",,False,Thu Oct 11 23:23:52 +0000 2012,2,256535619768049664
0,TweetDeck,"Chris Murphy wants specifics, where are his specifics? Chris Murphy has no plan. #ctsen #ctsendebate ~Staff",,False,Thu Oct 11 23:21:07 +0000 2012,2,256534928508997632
1,TweetDeck,"Even Hartford Courant says Chris Murphy's attacks are ""FALSE."" #ctsen #ctsendebate ~Staff",,False,Thu Oct 11 23:19:14 +0000 2012,4,256534452061224960
0,TweetDeck,".@ChrisMurphyCT entitlement solutions: less doctors, higher taxes &amp; people should work longer. #ctsen #ctsendebate ~Staff",,False,Thu Oct 11 23:16:08 +0000 2012,3,256533675129327616
0,TweetDeck,Chris Murphy voted to cut $716 billion from Medicare. #ctsen #ctsendebate ~Staff,,False,Thu Oct 11 23:14:29 +0000 2012,3,256533257343098881
0,TweetDeck,We can't afford another 6 years of Chris Murphy's failed policies. #ctsen #ctsendebate ~Staff,,False,Thu Oct 11 23:14:01 +0000 2012,3,256533139495735296
0,TweetDeck,Chris Murphy is breaking the rules as usual and reading from notes. #ctsen #ctsendebate ~Staff #MurphysLaw,,False,Thu Oct 11 23:11:30 +0000 2012,2,256532506399084544
1,TweetDeck,Murphy voted against Electric Boat funding TWICE this year. #ctsen #ctsendebate ~Staff,,False,Thu Oct 11 23:10:56 +0000 2012,4,256532362895171584
0,TweetDeck,Is Murphy reading from notes? #ctsen #ctsendebate ~Staff,,False,Thu Oct 11 23:09:49 +0000 2012,2,256532081750990849
0,TweetDeck,Chris Murphy has a record of raising middle-class taxes. #ctsen #ctsendebate ~Staff,,False,Thu Oct 11 23:07:54 +0000 2012,1,256531601318617088
0,TweetDeck,"Linda: ""I have a plan to cut middle-class taxes."" #ctsen #ctsendebate",,False,Thu Oct 11 23:07:25 +0000 2012,2,256531477456637952
0,TweetDeck,"""You voted against your Buy American plan - TWICE."" #ctsen #ctsendebate",,False,Thu Oct 11 23:06:05 +0000 2012,2,256531144063975424
1,TweetDeck,"After 13 years in elected office, no jobs plan from Murphy. #ctsen #ctsendebate ~Staff",,False,Thu Oct 11 23:05:19 +0000 2012,3,256530949553147905
0,TweetDeck,Linda has a six-point plan to cut taxes for the middle class. #ctsen #ctsendebate ~Staff,,False,Thu Oct 11 23:04:21 +0000 2012,1,256530708426809344
0,TweetDeck,Watch tonight's #ctsen debate live on FOX CT or at: http://t.co/5WDN4OFB. ~Staff #ctsendebate,,False,Thu Oct 11 22:54:54 +0000 2012,2,256528330877190144
2,Twitter for iPhone,#TeamLinda is excited for tonight's debate! Tune in at 7 to FOX CT &amp; tweet along using: #ctsendebate ~Staff http://t.co/yT19YFOv,,False,Thu Oct 11 22:26:41 +0000 2012,7,256521227680759808
0,TweetDeck,"Congressman Murphy continues his false smear campaign against Linda, claiming she's ""anti-woman."" http://t.co/1a7WJxQk #ctsen ~Staff",,False,Thu Oct 11 17:25:38 +0000 2012,3,256445466122780672
0,TweetDeck,"Courant: Social Security attack against Linda is ""a political charge that has no base."" Attack ad rated ""FALSE!"" http://t.co/ynmU3Diy ~Staff",,False,Thu Oct 11 15:33:23 +0000 2012,7,256417216369680385
0,TweetDeck,.ChrisMurphyCT voted to cut $716 bil from Medicare &amp; to raise middle-class Social Security taxes. Watch: http://t.co/Yy9Gytyn RT! ~Staff,,False,Thu Oct 11 13:09:39 +0000 2012,5,256381045220470784
2,TweetDeck,Honored to be endorsed by US Chamber. I've spent my career creating jobs &amp; will take that w/ me to US Senate. http://t.co/pgjXE3zd #ctsen,,False,Wed Oct 10 16:56:44 +0000 2012,6,256075806747545600
2,TweetDeck,"Elected in '06, CT Dem. Reps. Courtney &amp; Murphy have different committee attendance records in Congress: http://t.co/gZD9HIU5 #ctsen ~Staff",,False,Wed Oct 10 13:10:23 +0000 2012,3,256018844462768128
1,Twitter for iPhone,Ending my day in Torrington for our field office grand opening. Love seeing so many friends &amp; supporters! #ctsen http://t.co/eZR4WkQZ,,False,Tue Oct 09 22:51:25 +0000 2012,10,255802676867108864
0,TweetDeck,Who takes $1 mil in salary but missed nearly 80% of his committee hearings? @ChrisMurphyCT. http://t.co/WoBqRer9 #ctsen ~Staff,,False,Tue Oct 09 14:26:42 +0000 2012,6,255675659949572098
0,Twitter for iPhone,Started off my day w/ Northwest CT Chamber for a roundtable discussion. We talked jobs and the economy. #ctsen http://t.co/lYm7N3PU,,False,Tue Oct 09 14:23:46 +0000 2012,2,255674919738814466
0,TweetDeck,LCV announcement is nothing more than partisan politics since Linda has never cast an anti-environment vote. http://t.co/MmRxsHGv ~Staff,,False,Tue Oct 09 13:47:39 +0000 2012,1,255665834322710528
1,Twitter for iPhone,Visiting w/ seniors at Colchester Commons. I promise not to touch the benefits for seniors getting them today. #ctsen http://t.co/ZfDN0mTC,,False,Tue Oct 09 00:41:12 +0000 2012,1,255467916068278273
3,Twitter for iPad,Discussed jobs and the economy at tonight's Conversation with Linda in Amston. #ctsen http://t.co/NBNspDi6,,False,Mon Oct 08 23:40:33 +0000 2012,4,255452651796451328
0,Twitter for iPhone,Beautiful day at Mystic Seaport. Toured the restoration project of a 19th century whaling ship! #ctsen http://t.co/SYuIq4uY,,False,Mon Oct 08 18:21:47 +0000 2012,5,255372430724435968
0,TweetDeck,"""Linda is an independent-minded leader who won't be swayed by partisan politics."" RT our new ad! http://t.co/P9s7xHGK #ctsen ~Staff",,False,Mon Oct 08 14:44:29 +0000 2012,8,255317748257796096
0,TweetDeck,Only @ChrisMurphyCT would hold a press conference for legislation he voted against: http://t.co/jIPjPsKI. #ctsen ~Staff,,False,Mon Oct 08 14:10:05 +0000 2012,3,255309090824269824
2,Twitter for iPhone,Listened to great music and talked with voters at the Columbus Day Festival in New Haven! #ctsen http://t.co/vXBGMGJ8,,False,Sun Oct 07 22:06:11 +0000 2012,5,255066517648076801
2,Twitter for iPhone,Talked with voters at the Berlin Fair! #ctsen http://t.co/pO92Uh2N,,False,Sun Oct 07 20:48:55 +0000 2012,2,255047072892452864
0,TweetDeck,You have a choice between someone who will fight to protect defense jobs &amp; someone who's voted to cut funding for CT sub bases TWICE. #ctsen,,False,Sun Oct 07 16:31:29 +0000 2012,13,254982289501601793
1,TweetDeck,"You have a choice between someone who showed up for work every day &amp; someone who skipped 75% of taxpayer-funded, $170,000-a-year job. #ctsen",,False,Sun Oct 07 16:29:52 +0000 2012,7,254981881395810304
2,TweetDeck,"You have a choice between someone who can't be bought &amp; someone who's already received a special loan deal from ""strong campaign supporter.""",,False,Sun Oct 07 16:24:20 +0000 2012,6,254980489079840769
0,TweetDeck,"You have a choice between someone who would cut middle-class taxes, and someone who has, and will, raise taxes on middle class. #ctsen",,False,Sun Oct 07 16:05:09 +0000 2012,1,254975660236357632
1,TweetDeck,Linda: I would be honored to serve as your next US Senator. #ctsen #ctsendebate ~Staff,,False,Sun Oct 07 15:59:32 +0000 2012,6,254974247162744833
0,TweetDeck,Linda is the only candidate in this race with a real jobs plan. #ctsen #ctsendebate ~Staff,,False,Sun Oct 07 15:54:29 +0000 2012,5,254972977433698304
0,TweetDeck,Only candidate who’s voted to cut $716 billion from Medicare: @ChrisMurphyCT #ctsen #ctsendebate ~Staff,,False,Sun Oct 07 15:48:03 +0000 2012,3,254971356653961216
0,TweetDeck,"Again, @ChrisMurphyCT asked to answer the question. #ctsen #ctsendebate ~Staff",,False,Sun Oct 07 15:47:00 +0000 2012,0,254971092089847809
0,TweetDeck,.@ChrisMurphyCT voted against Electric Boat funding TWICE. #ctsen #ctsendebate ~Staff,,False,Sun Oct 07 15:42:03 +0000 2012,5,254969846318632960
0,TweetDeck,.@ChrisMurphyCT wants to cut defense spending. #ctsen #ctsendebate ~Staff,,False,Sun Oct 07 15:37:27 +0000 2012,2,254968688166465536
0,TweetDeck,.@ChrisMurphyCT try answering the question. #ctsen #ctsendebate ~Staff,,False,Sun Oct 07 15:35:08 +0000 2012,0,254968107414728704
0,TweetDeck,.@ChrisMurphyCT has voted numerous times to raise taxes on middle class. #ctsen #ctsendebate ~Staff,,False,Sun Oct 07 15:31:30 +0000 2012,10,254967193295527936
0,TweetDeck,.@ChrisMurphyCT has to be reminded again to answer the question. #ctsen #ctsendebate ~Staff,,False,Sun Oct 07 15:29:20 +0000 2012,0,254966648979718145
0,TweetDeck,Ferris Bueller would be proud of @ChrisMurphyCT attendance record. #ctsen #ctsendebate ~Staff,,False,Sun Oct 07 15:28:56 +0000 2012,6,254966547615993857
0,TweetDeck,.@ChrisMurphyCT fought so hard to skip 75% of his work meetings. #ctsen #ctsendebate ~Staff,,False,Sun Oct 07 15:26:57 +0000 2012,5,254966046493114369
0,TweetDeck,"RT @dlahern: ""I will not do anything that will impact women's health care issues"" Linda McMahon  #ctsendebate",,True,Sun Oct 07 15:25:13 +0000 2012,2,254965609853509632
1,TweetDeck,"Linda is a woman, a pro-choice woman. #ctsen #ctsendebate ~Staff",,False,Sun Oct 07 15:23:21 +0000 2012,4,254965141496545280
1,TweetDeck,"Hey Dennis, remind @ChrisMurphyCT to answer the questions. #ctsen #ctsendebate ~Staff",,False,Sun Oct 07 15:21:44 +0000 2012,3,254964735609548800
0,TweetDeck,Linda will not support any budget that cuts Medicare or Social Security. #ctsen #ctsendebate ~Staff,,False,Sun Oct 07 15:21:11 +0000 2012,6,254964597793120256
0,TweetDeck,Linda: My plan is the only one that has an actual middle-class tax cut. #ctsen #ctsendebate,,False,Sun Oct 07 15:15:26 +0000 2012,8,254963150800162816
2,TweetDeck,Who spent $50 mil of taxpayer money every 8 minutes while in Congress? @ChrisMurphyCT #ctsen #ctsendebate ~Staff,,False,Sun Oct 07 15:14:22 +0000 2012,5,254962881286778880
0,TweetDeck,Linda: Chris Murphy thought this race would be a coronation. #ctsen #ctsendebate,,False,Sun Oct 07 15:13:29 +0000 2012,1,254962660263739392
4,TweetDeck,This is a serious race with a serious woman. #ctsen #ctsendebate,,False,Sun Oct 07 15:12:16 +0000 2012,5,254962351219032064
0,TweetDeck,Linda’s Jobs Plan will save the average CT family of four $500 a month next year. #ctsen #ctsendebate http://t.co/FE8OQTZs ~Staff,,False,Sun Oct 07 15:09:37 +0000 2012,6,254961684333084672
0,TweetDeck,.@ChrisMurphyCT has no jobs plan. #ctsen #ctsendebate ~Staff,,False,Sun Oct 07 15:07:51 +0000 2012,3,254961241532010496
0,TweetDeck,Linda has a six-point plan to revive the economy and get CT working again. #ctsen #ctsendebate ~Staff,,False,Sun Oct 07 15:06:40 +0000 2012,3,254960944017448960
1,TweetDeck,"""Can the people of CT trust @ChrisMurphyCT?"" No! #ctsen #ctsendebate ~Staff",,False,Sun Oct 07 15:06:12 +0000 2012,1,254960826866356225
0,TweetDeck,"RT @ToniBoucher: 170,000 people woke up today in our state without a job - we need Linda in the senate to help create jobs #ctsendebate  ...",,True,Sun Oct 07 15:03:56 +0000 2012,6,254960255270780928
0,TweetDeck,"With 25% attendance rate, surprised @ChrisMurphyCT showed up. #ctsen #ctsendebate ~Staff",,False,Sun Oct 07 15:01:07 +0000 2012,4,254959544902488064
1,Twitter for iPhone,#TeamLinda excited for debate! Tune in to @wfsbnews at 11 am and tweet along using: #ctsendebate ~Staff http://t.co/VHtX2lMB,,False,Sun Oct 07 14:51:23 +0000 2012,1,254957097454821378
1,TweetDeck,"ICYMI: ""Murphy Stumbles on McMahon Footnotes"" http://t.co/fqT7NjSx #ctsen ~Staff",,False,Sun Oct 07 00:57:11 +0000 2012,7,254747162230005760
0,TweetDeck,.@ChrisMurphyCT should be ashamed of himself: http://t.co/lu9UOfd5 #ctsen ~Staff,,False,Sun Oct 07 00:24:36 +0000 2012,5,254738965976997888
1,Twitter for iPhone,Was great seeing so many friends and supporters at the Harwinton Fair! #ctsen http://t.co/N1EDTzfu,,False,Sat Oct 06 20:48:09 +0000 2012,3,254684489907843072
0,Twitter for iPhone,"Enjoyed ""Conversations with Linda"" this morning with some ladies in Harwinton! #ctsen http://t.co/4CGh8DMG",,False,Sat Oct 06 16:28:59 +0000 2012,2,254619269508251648
2,Twitter for iPhone,Do you think Chris Murphy will show up to debate tomorrow? His congressional attendance record proves that could be unlikely. #ctsen ~Staff,,False,Sat Oct 06 14:22:58 +0000 2012,2,254587559244595200
1,TweetDeck,How many debates do you think Chris Murphy will show up to? Play our new game: http://t.co/D2Gstvw2 and RT! #ctsen ~Staff,,False,Sat Oct 06 13:29:24 +0000 2012,6,254574076889296896
0,Twitter Web Client,#FF @farmingtonctgop @DarienRTC @StamfordGOP @woodstockrtc @HartfordCTGOP @GreenwichRTC @StaffordRTC @FairfieldRTC @SeymourRTC,,False,Sat Oct 06 02:49:19 +0000 2012,4,254412994472194048
0,TweetDeck,Great morning at the Archbishop's Columbus Day Breakfast in New Haven! #ctsen http://t.co/8IPhyVtg,,False,Fri Oct 05 18:42:54 +0000 2012,2,254290581256286208
0,TweetDeck,Who do you think is a bigger slacker - @ChrisMurphyCT or Ferris Bueller? REPLY with your answer! #ctsen ~Staff,,False,Fri Oct 05 17:02:50 +0000 2012,2,254265403520454657
1,TweetDeck,Check out our latest infographic detailing @ChrisMurphyCT chronic truancy: http://t.co/uS3raKGB and RT! #ctsen ~Staff,,False,Fri Oct 05 14:50:06 +0000 2012,3,254231999399747584
0,TweetDeck,Brad Davis records first-ever endorsement of political candidate in ad supporting Linda for U.S. Senate. http://t.co/4N9jX9U8 #ctsen ~Staff,,False,Thu Oct 04 15:31:09 +0000 2012,0,253879940636884992
0,TweetDeck,.@ChrisMurphyCT skipped four congressional hearings related to home foreclosures. http://t.co/VXvsfOA6 #ctsen ~Staff,,False,Thu Oct 04 13:34:42 +0000 2012,5,253850636364423169
3,TweetDeck,Today's Quinnipiac Poll shows CT voters are clearly embracing Linda's plan to cut middle-class taxes: http://t.co/VXZDngXt RT! #ctsen ~Staff,,False,Thu Oct 04 12:38:30 +0000 2012,6,253836490755428352
0,Twitter for iPhone,Thank you Congressman Rob Simmons for introducing and hosting me at tonight's rally in Groton! #ctsen http://t.co/4ty2c1Yo,,False,Wed Oct 03 23:57:54 +0000 2012,5,253645075094073346
0,Twitter for iPhone,RT @Brice57: Two nice younger volunteers for the @Linda_McMahon team stopped by the house this evening. They were informed that Linda ha ...,,True,Wed Oct 03 22:39:09 +0000 2012,1,253625263362035713
0,Twitter for iPhone,Had good conversation at lunch with the Greenwich Rotary Club! #ctsen http://t.co/cV977ltT,,False,Wed Oct 03 20:11:31 +0000 2012,2,253588106173902848
1,TweetDeck,Murphy is not being honest about his record on Social Security &amp; Medicare. Watch our new ad: http://t.co/JlmvWoBP RT! #ctsen ~Staff,,False,Wed Oct 03 16:35:32 +0000 2012,4,253533755342467072
2,TweetDeck,Chris Murphy skipped committee hearings on job creation. His failure to offer a jobs plan is no surprise. http://t.co/Bi5zrEaB #ctsen ~Staff,,False,Wed Oct 03 13:23:39 +0000 2012,3,253485467230691328
